"identifier","de","fr","it","rm","en","date","version","type"
"tests-demography","In der Berichtswoche wurden in den Altersklassen zwischen 30 und 49 Jahren je <fc>ber 30<U+00A0>000 Tests gemeldet. Dies beinhaltet PCR-Tests sowie Antigen-Schnelltests. Bezogen auf die Bev<f6>lkerungszahl wurden in den Altersklassen zwischen 20 und 49 Jahren mit jeweils <fc>ber 2<U+00A0>500 pro 100<U+00A0>000 Einw. und Woche am meisten Tests gemeldet. Im Vergleich zur Vorwoche hat sich die Anzahl der gemeldeten Tests in allen Altersklassen um weniger als <U+00B1><U+00A0>10<U+00A0>% ver<e4>ndert, ausser bei den unter 10-J<e4>hrigen (+11<U+00A0>%). Das Medianalter der getesteten Personen lag bei 40 Jahren. Seit Woche<U+00A0>03/2021 bewegt sich das Medianalter zwischen 38 und 41 Jahren. Die Inzidenzrate der Tests unterschied sich in der Berichtswoche und der Vorwoche wenig zwischen den Geschlechtern","Durant la semaine sous revue, plus de 30<U+00A0>000<U+00A0>tests ont <e9>t<e9> d<e9>clar<e9>s pour chaque tranche d<U+0092><e2>ge entre 30 et 49<U+00A0>ans). Ce chiffre comprend les tests PCR et les tests rapides antig<e9>niques. Par rapport <e0> la population, les classes d<U+0092><e2>ge de 20 <e0> 49<U+00A0>ans ont <e9>t<e9> les plus concern<e9>es avec, dans chaque groupe, plus de 2<U+00A0>500<U+00A0>tests d<e9>clar<e9>s pour 100<U+00A0>000<U+00A0>habitants par semaine. En comparaison avec la semaine pr<e9>c<e9>dente, le nombre de tests d<e9>clar<e9>s est rest<e9> stable dans toutes les classes d<U+0092><e2>ge (moins de <U+00B1><U+00A0>10<U+00A0>%), <e0> l<U+0092>exception des moins de 10 ans (+<U+00A0>11<U+00A0>%). L<U+0092><e2>ge m<e9>dian des personnes test<e9>es <e9>tait de 40<U+00A0>ans. Depuis la semaine<U+00A0>03, ce chiffre varie entre 38 et 41<U+00A0>ans. Il y a eu peu de diff<e9>rence dans le taux de d<e9>pistage entre les sexes durant la semaine sous revue ainsi que la semaine pr<e9>c<e9>dente.","Nella settimana in rassegna, nelle fasce d<U+0092>et<e0> tra i 30 e i 49 anni sono stati dichiarati oltre 30<U+00A0>000 test. Tale cifra comprende sia i test PCR sia i test antigenici rapidi. In rapporto all<U+0092>intera popolazione, le fasce d<U+0092>et<e0> tra i 20 e i 49 anni sono state quelle in cui <e8> stato dichiarato il maggior numero di test, ciascuna con oltre 2<U+00A0>500 test alla settimana per 100<U+00A0>000 abitanti. Rispetto alla settimana precedente, la variazione del numero di test dichiarati <e8> stata inferiore a <U+00B1>10<U+00A0>% in tutte le fasce d<U+0092>et<e0>, con l'eccezione delle persone di et<e0> inferiore ai 10 anni (+11%). L<U+0092>et<e0> mediana delle persone sottoposte a test <e8> stata di 40 anni. Dalla settimana 03/2021 oscilla tra i 38 e i 41 anni. Nella settimana in rassegna e in quella precedente il tasso di test <e8> stato pressoch<e9> identico tra i generi.","In der Berichtswoche wurden in den Altersklassen zwischen 30 und 49 Jahren je <fc>ber 30<U+00A0>000 Tests gemeldet. Dies beinhaltet PCR-Tests sowie Antigen-Schnelltests. Bezogen auf die Bev<f6>lkerungszahl wurden in den Altersklassen zwischen 20 und 49 Jahren mit jeweils <fc>ber 2<U+00A0>500 pro 100<U+00A0>000 Einw. und Woche am meisten Tests gemeldet. Im Vergleich zur Vorwoche hat sich die Anzahl der gemeldeten Tests in allen Altersklassen um weniger als <U+00B1><U+00A0>10<U+00A0>% ver<e4>ndert, ausser bei den unter 10-J<e4>hrigen (+11<U+00A0>%). Das Medianalter der getesteten Personen lag bei 40 Jahren. Seit Woche<U+00A0>03/2021 bewegt sich das Medianalter zwischen 38 und 41 Jahren. Die Inzidenzrate der Tests unterschied sich in der Berichtswoche und der Vorwoche wenig zwischen den Geschlechtern","In der Berichtswoche wurden in den Altersklassen zwischen 30 und 49 Jahren je <fc>ber 30<U+00A0>000 Tests gemeldet. Dies beinhaltet PCR-Tests sowie Antigen-Schnelltests. Bezogen auf die Bev<f6>lkerungszahl wurden in den Altersklassen zwischen 20 und 49 Jahren mit jeweils <fc>ber 2<U+00A0>500 pro 100<U+00A0>000 Einw. und Woche am meisten Tests gemeldet. Im Vergleich zur Vorwoche hat sich die Anzahl der gemeldeten Tests in allen Altersklassen um weniger als <U+00B1><U+00A0>10<U+00A0>% ver<e4>ndert, ausser bei den unter 10-J<e4>hrigen (+11<U+00A0>%). Das Medianalter der getesteten Personen lag bei 40 Jahren. Seit Woche<U+00A0>03/2021 bewegt sich das Medianalter zwischen 38 und 41 Jahren. Die Inzidenzrate der Tests unterschied sich in der Berichtswoche und der Vorwoche wenig zwischen den Geschlechtern",202116,"2021-04-28_07-49-44","COVID19WeeklyReportText"
"overview-short_description","Im Vergleich zur Vorwoche sank in der Berichtswoche (Woche 17/2021) die Zahl der gemeldeten F<e4>lle, w<e4>hrend die Zahl der gemeldeten Hospitalisationen und Tests stagnierte. Die Zahl der Todesf<e4>lle stieg.","En comparaison avec la semaine pr<e9>c<e9>dente, le nombre de cas d<e9>clar<e9>s a diminu<e9> pendant la semaine sous revue (semaine<U+00A0>17/2021), alors que celui des hospitalisations et des tests d<e9>clar<e9>s a stagn<e9>. Le nombre de d<e9>c<e8>s a augment<e9>.","Rispetto alla settimana precedente, nella settimana in rassegna (settimana 17/2021) il numero di casi dichiarati <e8> sceso, mentre il numero di ricoveri ospedalieri e di test dichiarati <e8> rimasto stagnante. Il numero di decessi <e8> aumentato.","Im Vergleich zur Vorwoche sank in der Berichtswoche (Woche 17/2021) die Zahl der gemeldeten F<e4>lle, w<e4>hrend die Zahl der gemeldeten Hospitalisationen und Tests stagnierte. Die Zahl der Todesf<e4>lle stieg.","Im Vergleich zur Vorwoche sank in der Berichtswoche (Woche 17/2021) die Zahl der gemeldeten F<e4>lle, w<e4>hrend die Zahl der gemeldeten Hospitalisationen und Tests stagnierte. Die Zahl der Todesf<e4>lle stieg.",202117,"2021-05-05_07-43-29","COVID19WeeklyReportText"
"overview-cases","F<fc>r die Berichtswoche wurden insgesamt 11<U+00A0>915 laborbest<e4>tigte F<e4>lle gemeldet. Somit sank die Anzahl gemeldeter F<e4>lle von 14<U+00A0>570 in der Vorwoche (-<U+00A0>18,2<U+00A0>%). Die Inzidenz der laborbest<e4>tigten F<e4>lle in den Kantonen und im FL lag zwischen 93 F<e4>llen pro 100<U+00A0>000 Einwohnerinnen und Einwohner und Woche im TI und 373 in UR.","Pour la semaine sous revue, un total de 11<U+00A0>915 cas confirm<e9>s en laboratoire a <e9>t<e9> d<e9>clar<e9>, marquant ainsi une diminution par rapport aux 14<U+00A0>570 cas d<e9>clar<e9>s de la semaine pr<e9>c<e9>dente (-<U+00A0>18,2<U+00A0>%). L<U+0092>incidence des cas confirm<e9>s en laboratoire dans les cantons et le Liechtenstein <e9>tait comprise entre 93 cas pour 100<U+00A0>000<U+00A0>habitants par semaine <e0> TI et 373 <e0> UR.","Per la settimana in rassegna sono stati dichiarati complessivamente 11<U+00A0>915 casi confermati in laboratorio, per cui il numero di casi dichiarati <e8> sceso rispetto ai 14<U+00A0>570 della settimana precedente (-18,2<U+00A0>%). L<U+0092>incidenza dei casi confermati in laboratorio nei Cantoni e in FL ha oscillato tra i 93 casi alla settimana per 100<U+00A0>000 abitanti in TI e i 373 in UR.","F<fc>r die Berichtswoche wurden insgesamt 11<U+00A0>915 laborbest<e4>tigte F<e4>lle gemeldet. Somit sank die Anzahl gemeldeter F<e4>lle von 14<U+00A0>570 in der Vorwoche (-<U+00A0>18,2<U+00A0>%). Die Inzidenz der laborbest<e4>tigten F<e4>lle in den Kantonen und im FL lag zwischen 93 F<e4>llen pro 100<U+00A0>000 Einwohnerinnen und Einwohner und Woche im TI und 373 in UR.","F<fc>r die Berichtswoche wurden insgesamt 11<U+00A0>915 laborbest<e4>tigte F<e4>lle gemeldet. Somit sank die Anzahl gemeldeter F<e4>lle von 14<U+00A0>570 in der Vorwoche (-<U+00A0>18,2<U+00A0>%). Die Inzidenz der laborbest<e4>tigten F<e4>lle in den Kantonen und im FL lag zwischen 93 F<e4>llen pro 100<U+00A0>000 Einwohnerinnen und Einwohner und Woche im TI und 373 in UR.",202117,"2021-05-05_07-43-29","COVID19WeeklyReportText"
"overview-hospitalisations","F<fc>r die Berichtswoche wurden bisher 381 Hospitalisationen im Zusammenhang mit einer laborbest<e4>tigten COVID-19-Erkrankung gemeldet. In der Vorwoche waren es zum selben Zeitpunkt 395 gemeldete Hospitalisationen. Somit ist angesichts der ausstehenden Nachmeldungen eine Stagnation bei den Hospitalisationen zu erwarten. Die durchschnittliche Zahl der Patientinnen und Patienten mit einer COVID-19-Erkrankung auf einer Intensivpflegestation lag in der Berichtswoche bei 253 Personen im Vergleich zu 248 in der Vorwoche.","Jusqu<U+0092>ici, 381 hospitalisations en lien avec un COVID-19 confirm<e9> en laboratoire ont <e9>t<e9> d<e9>clar<e9>es pour la semaine sous revue. La semaine pr<e9>c<e9>dente, au m<ea>me moment, leur nombre <e9>tait de 395. Au vu des d<e9>clarations tardives encore attendues, une stagnation du nombre d<U+0092>hospitalisations est donc attendue. Le nombre moyen de patients atteints du COVID-19 hospitalis<e9>s dans une unit<e9> de soins intensifs <e9>tait de 253 pendant la semaine sous revue et de 248 la semaine pr<e9>c<e9>dente.","Per la settimana in rassegna, finora sono stati dichiarati 381 ricoveri per COVID-19 confermata in laboratorio, contro i 395 dichiarati nello stesso momento della settimana precedente. Date le dichiarazioni tardive ancora attese, <e8> quindi probabile una stagnazione del numero di ricoveri. Il numero medio di pazienti ricoverati per COVID-19 in un reparto di cure intense nella settimana in rassegna <e8> stato di 253, contro i 248 della settimana precedente.","F<fc>r die Berichtswoche wurden bisher 381 Hospitalisationen im Zusammenhang mit einer laborbest<e4>tigten COVID-19-Erkrankung gemeldet. In der Vorwoche waren es zum selben Zeitpunkt 395 gemeldete Hospitalisationen. Somit ist angesichts der ausstehenden Nachmeldungen eine Stagnation bei den Hospitalisationen zu erwarten. Die durchschnittliche Zahl der Patientinnen und Patienten mit einer COVID-19-Erkrankung auf einer Intensivpflegestation lag in der Berichtswoche bei 253 Personen im Vergleich zu 248 in der Vorwoche.","F<fc>r die Berichtswoche wurden bisher 381 Hospitalisationen im Zusammenhang mit einer laborbest<e4>tigten COVID-19-Erkrankung gemeldet. In der Vorwoche waren es zum selben Zeitpunkt 395 gemeldete Hospitalisationen. Somit ist angesichts der ausstehenden Nachmeldungen eine Stagnation bei den Hospitalisationen zu erwarten. Die durchschnittliche Zahl der Patientinnen und Patienten mit einer COVID-19-Erkrankung auf einer Intensivpflegestation lag in der Berichtswoche bei 253 Personen im Vergleich zu 248 in der Vorwoche.",202117,"2021-05-05_07-43-29","COVID19WeeklyReportText"
"overview-deaths","F<fc>r die Berichtswoche wurden dem BAG bisher 60 Todesf<e4>lle im Zusammenhang mit einer laborbest<e4>tigten COVID-19-Erkrankung gemeldet. In der Vorwoche wurden bis zum selben Zeitpunkt 44 Todesf<e4>lle gemeldet. Damit nahm die Anzahl der Todesf<e4>lle in der Berichtswoche im Vergleich zur Vorwoche zu.","Pour la semaine sous revue, 60<U+00A0>d<e9>c<e8>s en lien avec un COVID-19 confirm<e9> en laboratoire ont <e9>t<e9> enregistr<e9>s jusqu<U+0092>ici. La semaine pr<e9>c<e9>dente au m<ea>me moment, leur nombre <e9>tait de 44. Le nombre des d<e9>c<e8>s a ainsi augment<e9> dans la semaine sous revue par rapport <e0> la semaine pr<e9>c<e9>dente.","Per la settimana in rassegna, sono finora stati dichiarati all<U+0092>UFSP 60 decessi in relazione a COVID-19 confermata in laboratorio. Fino allo stesso momento della settimana precedente ne sono stati dichiarati 44. Nella settimana in rassegna il numero di decessi <e8> quindi aumentato rispetto a quella precedente.","F<fc>r die Berichtswoche wurden dem BAG bisher 60 Todesf<e4>lle im Zusammenhang mit einer laborbest<e4>tigten COVID-19-Erkrankung gemeldet. In der Vorwoche wurden bis zum selben Zeitpunkt 44 Todesf<e4>lle gemeldet. Damit nahm die Anzahl der Todesf<e4>lle in der Berichtswoche im Vergleich zur Vorwoche zu.","F<fc>r die Berichtswoche wurden dem BAG bisher 60 Todesf<e4>lle im Zusammenhang mit einer laborbest<e4>tigten COVID-19-Erkrankung gemeldet. In der Vorwoche wurden bis zum selben Zeitpunkt 44 Todesf<e4>lle gemeldet. Damit nahm die Anzahl der Todesf<e4>lle in der Berichtswoche im Vergleich zur Vorwoche zu.",202117,"2021-05-05_07-43-29","COVID19WeeklyReportText"
"overview-tests","In der Berichtswoche wurden 183<U+00A0>614 Tests (72,4<U+00A0>% PCR und 27,6<U+00A0>% Antigen-Schnelltests) gemeldet. Im Vergleich zur Vorwoche ist die Anzahl Tests mit -<U+00A0>0,6<U+00A0>% in etwa gleichgeblieben. Der Anteil positiver PCR-Tests ist gesunken (von 9,6<U+00A0>% auf 8,3<U+00A0>%), ebenso der Anteil positiver Antigen-Schnelltests (von 5,6<U+00A0>% auf 4,5<U+00A0>%). Pro Person sind mehrere positive und negative Tests m<f6>glich.","Au cours de la semaine sous revue, 183<U+00A0>614 tests (72,4<U+00A0>% de tests PCR et 27,6<U+00A0>% de tests rapides antig<e9>niques) ont <e9>t<e9> d<e9>clar<e9>s. Par rapport <e0> la semaine pr<e9>c<e9>dente, le nombre de tests est rest<e9> stable (-<U+00A0>0,6<U+00A0>%). La proportion de r<e9>sultats positifs a diminu<e9> pour les tests PCR (de 9,6<U+00A0>% <e0> 8,3<U+00A0>%) et pour les tests rapides antig<e9>niques (de 5,6<U+00A0>% <e0> 4,5<U+00A0>%). Plusieurs tests positifs ou n<e9>gatifs sont possibles chez la m<ea>me personne.","Nella settimana in rassegna sono stati dichiarati 183<U+00A0>614 test (72,4<U+00A0>% PCR e 27,6<U+00A0>% test antigenici rapidi), un numero che, con un - 0,6<U+00A0>%, <e8> rimasto pressoch<e9> uguale rispetto alla settimana precedente. La percentuale dei test PCR positivi <e8> scesa (dal 9,6<U+00A0>% all<U+0092>8,3<U+00A0>%), cos<ec> come quella dei test antigenici rapidi positivi (dal 5,6<U+00A0>% al 4,5<U+00A0>%). Per la stessa persona possono risultare positivi o negativi pi<f9> test.","In der Berichtswoche wurden 183<U+00A0>614 Tests (72,4<U+00A0>% PCR und 27,6<U+00A0>% Antigen-Schnelltests) gemeldet. Im Vergleich zur Vorwoche ist die Anzahl Tests mit -<U+00A0>0,6<U+00A0>% in etwa gleichgeblieben. Der Anteil positiver PCR-Tests ist gesunken (von 9,6<U+00A0>% auf 8,3<U+00A0>%), ebenso der Anteil positiver Antigen-Schnelltests (von 5,6<U+00A0>% auf 4,5<U+00A0>%). Pro Person sind mehrere positive und negative Tests m<f6>glich.","In der Berichtswoche wurden 183<U+00A0>614 Tests (72,4<U+00A0>% PCR und 27,6<U+00A0>% Antigen-Schnelltests) gemeldet. Im Vergleich zur Vorwoche ist die Anzahl Tests mit -<U+00A0>0,6<U+00A0>% in etwa gleichgeblieben. Der Anteil positiver PCR-Tests ist gesunken (von 9,6<U+00A0>% auf 8,3<U+00A0>%), ebenso der Anteil positiver Antigen-Schnelltests (von 5,6<U+00A0>% auf 4,5<U+00A0>%). Pro Person sind mehrere positive und negative Tests m<f6>glich.",202117,"2021-05-05_07-43-29","COVID19WeeklyReportText"
"overview-contact_tracing","Gem<e4>ss Meldungen von 26 Kantonen und dem FL befanden sich am 04.05.2021 insgesamt 14<U+00A0>803 Personen in Isolation und 23<U+00A0>228 in Quarant<e4>ne. Diese Zahlen sind im Vergleich zur Vorwoche konstant geblieben. Die Anzahl Personen in Quarant<e4>ne nach Einreise aus einem Land mit erh<f6>htem Ansteckungsrisiko ist leicht gestiegen auf 5<U+00A0>204, nach Angaben von 25 Kantonen und dem FL.","Au 4<U+00A0>mai 2021, selon la d<e9>claration de 26<U+00A0>cantons et du Liechtenstein, 14<U+00A0>803 personnes <e9>taient en isolement et 23<U+00A0>228 en quarantaine. Ces chiffres sont rest<e9>s stables par rapport <e0> ceux de la semaine pr<e9>c<e9>dente. Le nombre de personnes en quarantaine parce qu<U+0092>elles arrivaient d<U+0092>un pays <e0> risque <e9>lev<e9> de contamination a l<e9>g<e8>rement augment<e9> <e0> 5<U+00A0>204, d<U+0092>apr<e8>s les donn<e9>es de 25<U+00A0>cantons et du Liechtenstein.","Secondo le dichiarazioni di 26 Cantoni e di FL, il 04.05.2021 vi erano complessivamente 14<U+00A0>803 persone in isolamento e 23<U+00A0>228 in quarantena. Queste cifre sono rimaste costanti rispetto alla settimana precedente. Il numero di persone in quarantena giunte in Svizzera da un Paese con un elevato rischio di contagio <e8> salito leggermente, attestandosi a 5<U+00A0>204, secondo le dichiarazioni di 25 Cantoni e di FL.","Gem<e4>ss Meldungen von 26 Kantonen und dem FL befanden sich am 04.05.2021 insgesamt 14<U+00A0>803 Personen in Isolation und 23<U+00A0>228 in Quarant<e4>ne. Diese Zahlen sind im Vergleich zur Vorwoche konstant geblieben. Die Anzahl Personen in Quarant<e4>ne nach Einreise aus einem Land mit erh<f6>htem Ansteckungsrisiko ist leicht gestiegen auf 5<U+00A0>204, nach Angaben von 25 Kantonen und dem FL.","Gem<e4>ss Meldungen von 26 Kantonen und dem FL befanden sich am 04.05.2021 insgesamt 14<U+00A0>803 Personen in Isolation und 23<U+00A0>228 in Quarant<e4>ne. Diese Zahlen sind im Vergleich zur Vorwoche konstant geblieben. Die Anzahl Personen in Quarant<e4>ne nach Einreise aus einem Land mit erh<f6>htem Ansteckungsrisiko ist leicht gestiegen auf 5<U+00A0>204, nach Angaben von 25 Kantonen und dem FL.",202117,"2021-05-05_07-43-29","COVID19WeeklyReportText"
"cases-summary","Schweizweit (inkl. FL) wurden f<fc>r die Berichtswoche 11<U+00A0>915 F<e4>lle gemeldet, gegen<fc>ber 14<U+00A0>570 F<e4>llen in der Vorwoche. Die Inzidenz der F<e4>lle ist von 169 pro 100<U+00A0>000 Einwohnerinnen und Einwohner (Einw.) in der Vorwoche auf 138 gesunken (-<U+00A0>18,4<U+00A0>%).","En Suisse et au Liechtenstein, 11<U+00A0>915 cas ont <e9>t<e9> d<e9>clar<e9>s pour la semaine sous revue, contre 14<U+00A0>570 pour la semaine pr<e9>c<e9>dente. L<U+0092>incidence des cas a diminu<e9> de 169 pour 100<U+00A0>000 habitants durant la semaine pr<e9>c<e9>dente <e0> 138 (-<U+00A0>18,4<U+00A0>%).","In tutta la Svizzera (incl. FL) nella settimana in rassegna sono stati dichiarati 11<U+00A0>915 casi, contro i 14<U+00A0>570 della settimana precedente. L<U+0092>incidenza dei casi <e8> scesa da 169 ogni 100<U+00A0>000 abitanti nella settimana precedente a 138 (-<U+00A0>18,4<U+00A0>%).","Schweizweit (inkl. FL) wurden f<fc>r die Berichtswoche 11<U+00A0>915 F<e4>lle gemeldet, gegen<fc>ber 14<U+00A0>570 F<e4>llen in der Vorwoche. Die Inzidenz der F<e4>lle ist von 169 pro 100<U+00A0>000 Einwohnerinnen und Einwohner (Einw.) in der Vorwoche auf 138 gesunken (-<U+00A0>18,4<U+00A0>%).","Schweizweit (inkl. FL) wurden f<fc>r die Berichtswoche 11<U+00A0>915 F<e4>lle gemeldet, gegen<fc>ber 14<U+00A0>570 F<e4>llen in der Vorwoche. Die Inzidenz der F<e4>lle ist von 169 pro 100<U+00A0>000 Einwohnerinnen und Einwohner (Einw.) in der Vorwoche auf 138 gesunken (-<U+00A0>18,4<U+00A0>%).",202117,"2021-05-05_07-43-29","COVID19WeeklyReportText"
"cases-geography","Die Inzidenzrate lag in der Berichtswoche in 24 Kantonen und im FL <fc>ber 100 F<e4>llen pro 100<U+00A0>000 Einw. und Woche. Insgesamt lag die Inzidenzrate der laborbest<e4>tigten F<e4>lle in der Schweiz und in Liechtenstein zwischen 93 F<e4>llen pro 100<U+00A0>000 Einw. und Woche im TI und 373 in UR. In 17 Kantonen nahm die Inzidenzrate um mehr als 10<U+00A0>% ab. In 8 Kantonen und im FL ver<e4>nderte sich die Inzidenzrate mit <U+00B1>10<U+00A0>% wenig. Nur in AI stieg die Inzidenzrate um mehr als 10<U+00A0>%. In der Mehrheit der Kantone sank die Inzidenzrate der laborbest<e4>tigten F<e4>lle pro 100<U+00A0>000 Einw. und Tag <fc>ber die letzten 4 Wochen tendenziell. Nach sechs Wochen mit hohen Fallzahlen in UR sanken diese in der Berichtswoche.","Pour la semaine sous revue, le taux d<U+0092>incidence <e9>tait, pour 100<U+00A0>000<U+00A0>habitants et par semaine, sup<e9>rieur <e0> 100<U+00A0>cas dans 24<U+00A0>cantons et au Liechtenstein. Le taux d<U+0092>incidence des cas confirm<e9>s en laboratoire en Suisse et au Liechtenstein variait, pour 100<U+00A0>000<U+00A0>habitants et par semaine, entre 93 cas <e0> TI et 373 <e0> UR. Dans 17<U+00A0>cantons, le taux d<U+0092>incidence a diminu<e9> de plus de 10<U+00A0>%. Dans 8<U+00A0>cantons et au Lichtenstein, il n<U+0092>a que peu chang<e9> (<U+00B1><U+00A0>10<U+00A0>%). Il a augment<e9> de plus de 10<U+00A0>% <e0> AI seulement. Dans la majorit<e9> des cantons, le taux d<U+0092>incidence des cas confirm<e9>s en laboratoire pour 100<U+00A0>000<U+00A0>habitants et par jour a eu tendance <e0> diminuer durant les quatre derni<e8>res semaines. Apr<e8>s avoir <e9>t<e9> <e9>lev<e9> durant six semaines, le nombre de cas a diminu<e9> <e0> UR durant la semaine sous revue.","Nella settimana in rassegna, il tasso di incidenza ha superato i 100 casi alla settimana per 100<U+00A0>000 abitanti in 24 Cantoni e in FL. Nel complesso, il tasso di incidenza dei casi confermati in laboratorio in Svizzera e in FL ha oscillato tra i 93 casi alla settimana per 100<U+00A0>000 abitanti in TI e i 373 in UR. In 17 Cantoni il tasso di incidenza <e8> diminuito di pi<f9> del 10<U+00A0>%. In 8 Cantoni e in FL il tasso di incidenza <e8> variato poco, con un <U+00B1><U+00A0>10<U+00A0>%. Soltanto in AI <e8> aumentato di pi<f9> del 10<U+00A0>%. Il tasso di incidenza dei casi confermati in laboratorio per 100<U+00A0>000 abitanti e per giorno <e8> tendenzialmente sceso nelle ultime 4 settimane nella maggior parte dei Cantoni. In UR, dopo sei settimane con un numero elevato di casi, si <e8> assistito a una diminuzione nella settimana in rassegna.","Die Inzidenzrate lag in der Berichtswoche in 24 Kantonen und im FL <fc>ber 100 F<e4>llen pro 100<U+00A0>000 Einw. und Woche. Insgesamt lag die Inzidenzrate der laborbest<e4>tigten F<e4>lle in der Schweiz und in Liechtenstein zwischen 93 F<e4>llen pro 100<U+00A0>000 Einw. und Woche im TI und 373 in UR. In 17 Kantonen nahm die Inzidenzrate um mehr als 10<U+00A0>% ab. In 8 Kantonen und im FL ver<e4>nderte sich die Inzidenzrate mit <U+00B1>10<U+00A0>% wenig. Nur in AI stieg die Inzidenzrate um mehr als 10<U+00A0>%. In der Mehrheit der Kantone sank die Inzidenzrate der laborbest<e4>tigten F<e4>lle pro 100<U+00A0>000 Einw. und Tag <fc>ber die letzten 4 Wochen tendenziell. Nach sechs Wochen mit hohen Fallzahlen in UR sanken diese in der Berichtswoche.","Die Inzidenzrate lag in der Berichtswoche in 24 Kantonen und im FL <fc>ber 100 F<e4>llen pro 100<U+00A0>000 Einw. und Woche. Insgesamt lag die Inzidenzrate der laborbest<e4>tigten F<e4>lle in der Schweiz und in Liechtenstein zwischen 93 F<e4>llen pro 100<U+00A0>000 Einw. und Woche im TI und 373 in UR. In 17 Kantonen nahm die Inzidenzrate um mehr als 10<U+00A0>% ab. In 8 Kantonen und im FL ver<e4>nderte sich die Inzidenzrate mit <U+00B1>10<U+00A0>% wenig. Nur in AI stieg die Inzidenzrate um mehr als 10<U+00A0>%. In der Mehrheit der Kantone sank die Inzidenzrate der laborbest<e4>tigten F<e4>lle pro 100<U+00A0>000 Einw. und Tag <fc>ber die letzten 4 Wochen tendenziell. Nach sechs Wochen mit hohen Fallzahlen in UR sanken diese in der Berichtswoche.",202117,"2021-05-05_07-43-29","COVID19WeeklyReportText"
