"identifier","de","fr","it","rm","en","date","version","type"
"overview-short_description","Im Vergleich zur Vorwoche ver<e4>nderten sich in der Berichtswoche (Woche 16/2021) die gemeldeten Zahlen der F<e4>lle, Hospitalisationen, und Tests kaum. Die Zahl der Todesf<e4>lle stieg leicht.","En comparaison avec la semaine pr<e9>c<e9>dente, le nombre de cas, d<U+0092>hospitalisations et de tests d<e9>clar<e9>s n<U+0092>ont presque pas chang<e9> pendant la semaine sous revue (semaine<U+00A0>16/2021). Le nombre de d<e9>c<e8>s a l<e9>g<e8>rement augment<e9>.","Rispetto alla settimana precedente, nella settimana in rassegna (settimana 16/2021) i casi, i ricoveri ospedalieri e i test dichiarati sono rimasti pressoch<e9> invariati. Il numero di decessi <e8> aumentato leggermente.","Im Vergleich zur Vorwoche ver<e4>nderten sich in der Berichtswoche (Woche 16/2021) die gemeldeten Zahlen der F<e4>lle, Hospitalisationen, und Tests kaum. Die Zahl der Todesf<e4>lle stieg leicht.","Im Vergleich zur Vorwoche ver<e4>nderten sich in der Berichtswoche (Woche 16/2021) die gemeldeten Zahlen der F<e4>lle, Hospitalisationen, und Tests kaum. Die Zahl der Todesf<e4>lle stieg leicht.",202116,"2021-04-28_07-49-44","COVID19WeeklyReportText"
"overview-cases","F<fc>r die Berichtswoche wurden insgesamt 14<U+00A0>542 laborbest<e4>tigte F<e4>lle gegen<fc>ber 14<U+00A0>136 in der Vorwoche gemeldet, somit stagnierte die Anzahl gemeldeter F<e4>lle (+2,9<U+00A0>%). Die Inzidenz der laborbest<e4>tigten F<e4>lle in den Kantonen und im FL lag zwischen 107 F<e4>llen pro 100<U+00A0>000 Einwohnerinnen und Einwohner und Woche in SH und 225 in GE, mit Ausnahme von UR (594).","Pour la semaine sous revue, un total de 14<U+00A0>542 cas confirm<e9>s en laboratoire a <e9>t<e9> d<e9>clar<e9>, contre 14<U+00A0>136 la semaine pr<e9>c<e9>dente<U+00A0>; les chiffres stagnent donc (+<U+00A0>2,9<U+00A0>%). L<U+0092>incidence des cas confirm<e9>s en laboratoire dans les cantons et le Liechtenstein <e9>tait comprise entre 107<U+00A0>cas pour 100<U+00A0>000<U+00A0>habitants par semaine <e0> SH et 225 <e0> GE, <e0> l<U+0092>exception de UR (594).","Per la settimana in rassegna sono stati dichiarati complessivamente 14<U+00A0>542 casi confermati in laboratorio, rispetto ai 14<U+00A0>136 nella settimana precedente, per cui il numero di casi dichiarati <e8> stagnante (+<U+00A0>2,9<U+00A0>%). L<U+0092>incidenza dei casi confermati in laboratorio nei Cantoni e in FL ha oscillato tra i 107 casi alla settimana per 100<U+00A0>000 abitanti in SH e i 225 in GE, con l<U+0092>eccezione di UR (594).","F<fc>r die Berichtswoche wurden insgesamt 14<U+00A0>542 laborbest<e4>tigte F<e4>lle gegen<fc>ber 14<U+00A0>136 in der Vorwoche gemeldet, somit stagnierte die Anzahl gemeldeter F<e4>lle (+2,9<U+00A0>%). Die Inzidenz der laborbest<e4>tigten F<e4>lle in den Kantonen und im FL lag zwischen 107 F<e4>llen pro 100<U+00A0>000 Einwohnerinnen und Einwohner und Woche in SH und 225 in GE, mit Ausnahme von UR (594).","F<fc>r die Berichtswoche wurden insgesamt 14<U+00A0>542 laborbest<e4>tigte F<e4>lle gegen<fc>ber 14<U+00A0>136 in der Vorwoche gemeldet, somit stagnierte die Anzahl gemeldeter F<e4>lle (+2,9<U+00A0>%). Die Inzidenz der laborbest<e4>tigten F<e4>lle in den Kantonen und im FL lag zwischen 107 F<e4>llen pro 100<U+00A0>000 Einwohnerinnen und Einwohner und Woche in SH und 225 in GE, mit Ausnahme von UR (594).",202116,"2021-04-28_07-49-44","COVID19WeeklyReportText"
"overview-hospitalisations","F<fc>r die Berichtswoche wurden bisher 395 Hospitalisationen im Zusammenhang mit einer laborbest<e4>tigten COVID-19-Erkrankung gemeldet. In der Vorwoche waren es zum selben Zeitpunkt 409 gemeldete Hospitalisationen. Somit ist angesichts der ausstehenden Nachmeldungen eine Stagnation bei den Hospitalisationen zu erwarten. Die durchschnittliche Zahl der Patientinnen und Patienten mit einer COVID-19-Erkrankung auf einer Intensivpflegestation ist in der Berichtswoche im Vergleich zur Vorwoche auf 248 Personen gestiegen (+6,0<U+00A0>%).","Jusqu<U+0092>ici, 395<U+00A0>hospitalisations en lien avec un COVID-19 confirm<e9> en laboratoire ont <e9>t<e9> d<e9>clar<e9>es pour la semaine sous revue. La semaine pr<e9>c<e9>dente, au m<ea>me moment, leur nombre <e9>tait de 409. Au vu des d<e9>clarations tardives encore attendues, une stagnation du nombre d<U+0092>hospitalisations est donc attendue. Pendant la semaine sous revue, le nombre moyen de patients atteints du COVID-19 hospitalis<e9>s dans une unit<e9> de soins intensifs (248) a augment<e9> par rapport <e0> la semaine pr<e9>c<e9>dente (+<U+00A0>6,0<U+00A0>%).","Per la settimana in rassegna, finora sono stati dichiarati 395 ricoveri per COVID-19 confermata in laboratorio, contro i 409 dichiarati nello stesso momento della settimana precedente. Date le dichiarazioni tardive ancora attese, <e8> quindi probabile una stagnazione del numero di ricoveri. Il numero medio di pazienti ricoverati per COVID-19 in un reparto di cure intense nella settimana in rassegna, pari a 248, <e8> aumentato rispetto alla settimana precedente (+ 6,0<U+00A0>%).","F<fc>r die Berichtswoche wurden bisher 395 Hospitalisationen im Zusammenhang mit einer laborbest<e4>tigten COVID-19-Erkrankung gemeldet. In der Vorwoche waren es zum selben Zeitpunkt 409 gemeldete Hospitalisationen. Somit ist angesichts der ausstehenden Nachmeldungen eine Stagnation bei den Hospitalisationen zu erwarten. Die durchschnittliche Zahl der Patientinnen und Patienten mit einer COVID-19-Erkrankung auf einer Intensivpflegestation ist in der Berichtswoche im Vergleich zur Vorwoche auf 248 Personen gestiegen (+6,0<U+00A0>%).","F<fc>r die Berichtswoche wurden bisher 395 Hospitalisationen im Zusammenhang mit einer laborbest<e4>tigten COVID-19-Erkrankung gemeldet. In der Vorwoche waren es zum selben Zeitpunkt 409 gemeldete Hospitalisationen. Somit ist angesichts der ausstehenden Nachmeldungen eine Stagnation bei den Hospitalisationen zu erwarten. Die durchschnittliche Zahl der Patientinnen und Patienten mit einer COVID-19-Erkrankung auf einer Intensivpflegestation ist in der Berichtswoche im Vergleich zur Vorwoche auf 248 Personen gestiegen (+6,0<U+00A0>%).",202116,"2021-04-28_07-49-44","COVID19WeeklyReportText"
"overview-deaths","F<fc>r die Berichtswoche wurden dem BAG bisher 44 Todesf<e4>lle im Zusammenhang mit einer laborbest<e4>tigten COVID-19-Erkrankung gemeldet. In der Vorwoche wurden zum selben Zeitpunkt 39 Todesf<e4>lle gemeldet. Angesichts der noch zu erwartenden Nachmeldungen ist eine leichte Zunahme der Anzahl Todesf<e4>lle in der Berichtswoche im Vergleich zur Vorwoche wahrscheinlich.","Pour la semaine sous revue, 44<U+00A0>d<e9>c<e8>s en lien avec un COVID-19 confirm<e9> en laboratoire ont <e9>t<e9> enregistr<e9>s jusqu<U+0092>ici. La semaine pr<e9>c<e9>dente, au m<ea>me moment, leur nombre <e9>tait de 39. Au vu des d<e9>clarations tardives encore attendues, il faut compter sur une l<e9>g<e8>re augmentation du nombre de d<e9>c<e8>s dans la semaine sous revue par rapport <e0> la semaine pr<e9>c<e9>dente.","Per la settimana in rassegna, sono finora stati dichiarati all<U+0092>UFSP 44 decessi in relazione a COVID-19 confermata in laboratorio. Nello stesso momento della settimana precedente, ne sono stati dichiarati 39. Date le dichiarazioni tardive ancora attese, nella settimana in rassegna si prevede un leggero aumento del numero di decessi rispetto a quella precedente.","F<fc>r die Berichtswoche wurden dem BAG bisher 44 Todesf<e4>lle im Zusammenhang mit einer laborbest<e4>tigten COVID-19-Erkrankung gemeldet. In der Vorwoche wurden zum selben Zeitpunkt 39 Todesf<e4>lle gemeldet. Angesichts der noch zu erwartenden Nachmeldungen ist eine leichte Zunahme der Anzahl Todesf<e4>lle in der Berichtswoche im Vergleich zur Vorwoche wahrscheinlich.","F<fc>r die Berichtswoche wurden dem BAG bisher 44 Todesf<e4>lle im Zusammenhang mit einer laborbest<e4>tigten COVID-19-Erkrankung gemeldet. In der Vorwoche wurden zum selben Zeitpunkt 39 Todesf<e4>lle gemeldet. Angesichts der noch zu erwartenden Nachmeldungen ist eine leichte Zunahme der Anzahl Todesf<e4>lle in der Berichtswoche im Vergleich zur Vorwoche wahrscheinlich.",202116,"2021-04-28_07-49-44","COVID19WeeklyReportText"
"overview-tests","In der Berichtswoche wurden 184<U+00A0>379 Tests (72,7<U+00A0>% PCR und 27,3<U+00A0>% Antigen-Schnelltests) gemeldet. Im Vergleich zur Vorwoche ist die Anzahl Tests mit -2,1<U+00A0>% in etwa gleich geblieben, ebenso der Anteil positiver Tests mit 9,6<U+00A0>% f<fc>r PCR-Tests und 5,6<U+00A0>% f<fc>r Antigen-Schnelltests.","Au cours de la semaine sous revue, 184<U+00A0>379 tests (72,7<U+00A0>% de tests PCR et 27,3<U+00A0>% de tests rapides antig<e9>niques) ont <e9>t<e9> d<e9>clar<e9>s. Par rapport <e0> la semaine pr<e9>c<e9>dente, le nombre de tests est rest<e9> stable (-<U+00A0>2,1<U+00A0>%), tout comme la proportion de r<e9>sultats positifs pour les tests PCR (9,6<U+00A0>%) et les tests rapides antig<e9>niques (5,6<U+00A0>%).","Nella settimana in rassegna sono stati dichiarati 184<U+00A0>379 test (72,7<U+00A0>% PCR e 27,3<U+00A0>% test antigenici rapidi), un numero che, con un - 2,1<U+00A0>%, <e8> rimasto pressoch<e9> uguale rispetto alla settimana precedente, cos<ec> come la percentuale dei test PCR positivi (9,6<U+00A0>%) e quella dei test antigenici rapidi positivi (5,6<U+00A0>%).","In der Berichtswoche wurden 184<U+00A0>379 Tests (72,7<U+00A0>% PCR und 27,3<U+00A0>% Antigen-Schnelltests) gemeldet. Im Vergleich zur Vorwoche ist die Anzahl Tests mit -2,1<U+00A0>% in etwa gleich geblieben, ebenso der Anteil positiver Tests mit 9,6<U+00A0>% f<fc>r PCR-Tests und 5,6<U+00A0>% f<fc>r Antigen-Schnelltests.","In der Berichtswoche wurden 184<U+00A0>379 Tests (72,7<U+00A0>% PCR und 27,3<U+00A0>% Antigen-Schnelltests) gemeldet. Im Vergleich zur Vorwoche ist die Anzahl Tests mit -2,1<U+00A0>% in etwa gleich geblieben, ebenso der Anteil positiver Tests mit 9,6<U+00A0>% f<fc>r PCR-Tests und 5,6<U+00A0>% f<fc>r Antigen-Schnelltests.",202116,"2021-04-28_07-49-44","COVID19WeeklyReportText"
"overview-contact_tracing","Gem<e4>ss Meldungen von 25 Kantonen und FL befanden sich am 27.04.2021 insgesamt 14<U+00A0>462 Personen in Isolation und 22<U+00A0>915 in Quarant<e4>ne. Diese Zahlen sind im Vergleich zur Vorwoche gesunken. Zus<e4>tzlich sank die Anzahl Personen in Quarant<e4>ne nach Einreise aus einem Land mit erh<f6>htem Ansteckungsrisiko auf 4<U+00A0>715, nach Angaben von 24 Kantonen und dem FL.","Au 27<U+00A0>avril 2021, selon la d<e9>claration de 25<U+00A0>cantons et du Liechtenstein, 14<U+00A0>462 personnes <e9>taient en isolement et 22<U+00A0>915<U+00A0>en quarantaine. Ces chiffres ont diminu<e9> par rapport <e0> ceux de la semaine pr<e9>c<e9>dente. En outre, le nombre de personnes en quarantaine parce qu<U+0092>elles arrivaient d<U+0092>un pays <e0> risque <e9>lev<e9> de contamination a <e9>galement diminu<e9> (4<U+00A0>715 d<U+0092>apr<e8>s les donn<e9>es de 24<U+00A0>cantons et du Liechtenstein).","Secondo le dichiarazioni di 25 Cantoni e di FL, il 27.04.2021 vi erano complessivamente 14<U+00A0>462 persone in isolamento e 22<U+00A0>915 in quarantena. Queste cifre sono scese rispetto alla settimana precedente. Anche il numero di persone in quarantena giunte in Svizzera da un Paese con un elevato rischio di contagio <e8> sceso, attestandosi a 4<U+00A0>715, secondo le dichiarazioni di 24 Cantoni e di FL.","Gem<e4>ss Meldungen von 25 Kantonen und FL befanden sich am 27.04.2021 insgesamt 14<U+00A0>462 Personen in Isolation und 22<U+00A0>915 in Quarant<e4>ne. Diese Zahlen sind im Vergleich zur Vorwoche gesunken. Zus<e4>tzlich sank die Anzahl Personen in Quarant<e4>ne nach Einreise aus einem Land mit erh<f6>htem Ansteckungsrisiko auf 4<U+00A0>715, nach Angaben von 24 Kantonen und dem FL.","Gem<e4>ss Meldungen von 25 Kantonen und FL befanden sich am 27.04.2021 insgesamt 14<U+00A0>462 Personen in Isolation und 22<U+00A0>915 in Quarant<e4>ne. Diese Zahlen sind im Vergleich zur Vorwoche gesunken. Zus<e4>tzlich sank die Anzahl Personen in Quarant<e4>ne nach Einreise aus einem Land mit erh<f6>htem Ansteckungsrisiko auf 4<U+00A0>715, nach Angaben von 24 Kantonen und dem FL.",202116,"2021-04-28_07-49-44","COVID19WeeklyReportText"
"cases-summary","Schweizweit (inkl. FL) wurden f<fc>r die Berichtswoche 14<U+00A0>542 F<e4>lle gemeldet, gegen<fc>ber 14<U+00A0>136 F<e4>llen in der Vorwoche. Die Inzidenz der F<e4>lle ist mit 168 pro 100<U+00A0>000 Einwohnerinnen und Einwohner (Einw.) im Vergleich zur Vorwoche etwa gleich geblieben (+2,9<U+00A0>%).","En Suisse et au Liechtenstein, 14<U+00A0>542<U+00A0>cas ont <e9>t<e9> d<e9>clar<e9>s pour la semaine sous revue, contre 14<U+00A0>136 pour la semaine pr<e9>c<e9>dente. L<U+0092>incidence des cas (168 pour 100<U+00A0>000 habitants) n<U+0092>a pratiquement pas vari<e9> (+<U+00A0>2,9<U+00A0>%).","In tutta la Svizzera (incl. FL) nella settimana in rassegna sono stati dichiarati 14<U+00A0>542 casi, contro i 14<U+00A0>136 della settimana precedente. L<U+0092>incidenza dei casi (168 ogni 100<U+00A0>000 abitanti (ab.)) <e8> rimasta pressoch<e9> invariata (+<U+00A0>2,9<U+00A0>%) rispetto alla settimana precedente.","Schweizweit (inkl. FL) wurden f<fc>r die Berichtswoche 14<U+00A0>542 F<e4>lle gemeldet, gegen<fc>ber 14<U+00A0>136 F<e4>llen in der Vorwoche. Die Inzidenz der F<e4>lle ist mit 168 pro 100<U+00A0>000 Einwohnerinnen und Einwohner (Einw.) im Vergleich zur Vorwoche etwa gleich geblieben (+2,9<U+00A0>%).","Schweizweit (inkl. FL) wurden f<fc>r die Berichtswoche 14<U+00A0>542 F<e4>lle gemeldet, gegen<fc>ber 14<U+00A0>136 F<e4>llen in der Vorwoche. Die Inzidenz der F<e4>lle ist mit 168 pro 100<U+00A0>000 Einwohnerinnen und Einwohner (Einw.) im Vergleich zur Vorwoche etwa gleich geblieben (+2,9<U+00A0>%).",202116,"2021-04-28_07-49-44","COVID19WeeklyReportText"
"cases-geography","Die Inzidenzrate lag in der Berichtswoche in allen Kantonen und im FL <fc>ber 100 F<e4>llen pro 100<U+00A0>000 Einw. und Woche. Insgesamt lag die Inzidenzrate der laborbest<e4>tigten F<e4>lle in der Schweiz und in Liechtenstein zwischen 107 F<e4>llen pro 100<U+00A0>000 Einw. und Woche in SH und 225 in GE, mit Ausnahme von UR (594). In 10 Kantonen nahm die Inzidenzrate um mehr als 10<U+00A0>% zu. In 11 Kantonen ver<e4>nderte sich die Inzidenz mit <U+00B1><U+00A0>10<U+00A0>% wenig. In 5 Kantonen und im FL sanken die F<e4>lle um mehr als 10<U+00A0>%. Die Inzidenzrate der laborbest<e4>tigten F<e4>lle pro 100<U+00A0>000 Einw. und Tag blieb in der Mehrheit der Kantone in der Berichtswoche im Vergleich zur Vorwoche stabil. Nach steigenden Fallzahlen w<e4>hrend f<fc>nf Wochen in UR kam es in der Berichtswoche und der Vorwoche zu einer Stagnation.","Pour la semaine sous revue, le taux d<U+0092>incidence <e9>tait, pour 100<U+00A0>000<U+00A0>habitants et par semaine, sup<e9>rieur <e0> 100<U+00A0>cas dans tous les cantons et au Liechtenstein. Le taux d<U+0092>incidence des cas confirm<e9>s en laboratoire en Suisse et au Liechtenstein variait, pour 100<U+00A0>000<U+00A0>habitants et par semaine, entre 107<U+00A0>cas <e0> SH et 225 <e0> GE, <e0> l<U+0092>exception de UR (594). Dans 10<U+00A0>cantons, le taux d<U+0092>incidence a augment<e9> de plus de 10<U+00A0>%. Dans 11<U+00A0>cantons, il n<U+0092>a que peu chang<e9> (<U+00B1><U+00A0>10<U+00A0>%), alors qu<U+0092>il a augment<e9> de plus de 10<U+00A0>% dans 5<U+00A0>cantons et au Liechtenstein.","Nella settimana in rassegna, il tasso di incidenza ha superato i 100 casi alla settimana per 100<U+00A0>000 abitanti in tutti i Cantoni e in FL. Nel complesso, il tasso di incidenza dei casi confermati in laboratorio in Svizzera e in FL ha oscillato tra i 107 casi alla settimana per 100<U+00A0>000 abitanti in SH e i 225 in GE, con l<U+0092>eccezione di UR (594). In 10 Cantoni il tasso di incidenza <e8> aumentato di pi<f9> del 10<U+00A0>%. In 11 Cantoni l<U+0092>incidenza <e8> variata poco, con un <U+00B1><U+00A0>10<U+00A0>%. In 5 Cantoni e in FL i casi sono diminuiti di pi<f9> del 10<U+00A0>%. Il tasso di incidenza dei casi confermati in laboratorio per 100<U+00A0>000 abitanti e per giorno <e8> rimasto stabile rispetto alla settimana precedente nella maggior parte dei Cantoni. In UR, dopo cinque settimane di casi in crescita si <e8> assistito a una stagnazione nella settimana in rassegna e in quella precedente.","Die Inzidenzrate lag in der Berichtswoche in allen Kantonen und im FL <fc>ber 100 F<e4>llen pro 100<U+00A0>000 Einw. und Woche. Insgesamt lag die Inzidenzrate der laborbest<e4>tigten F<e4>lle in der Schweiz und in Liechtenstein zwischen 107 F<e4>llen pro 100<U+00A0>000 Einw. und Woche in SH und 225 in GE, mit Ausnahme von UR (594). In 10 Kantonen nahm die Inzidenzrate um mehr als 10<U+00A0>% zu. In 11 Kantonen ver<e4>nderte sich die Inzidenz mit <U+00B1><U+00A0>10<U+00A0>% wenig. In 5 Kantonen und im FL sanken die F<e4>lle um mehr als 10<U+00A0>%. Die Inzidenzrate der laborbest<e4>tigten F<e4>lle pro 100<U+00A0>000 Einw. und Tag blieb in der Mehrheit der Kantone in der Berichtswoche im Vergleich zur Vorwoche stabil. Nach steigenden Fallzahlen w<e4>hrend f<fc>nf Wochen in UR kam es in der Berichtswoche und der Vorwoche zu einer Stagnation.","Die Inzidenzrate lag in der Berichtswoche in allen Kantonen und im FL <fc>ber 100 F<e4>llen pro 100<U+00A0>000 Einw. und Woche. Insgesamt lag die Inzidenzrate der laborbest<e4>tigten F<e4>lle in der Schweiz und in Liechtenstein zwischen 107 F<e4>llen pro 100<U+00A0>000 Einw. und Woche in SH und 225 in GE, mit Ausnahme von UR (594). In 10 Kantonen nahm die Inzidenzrate um mehr als 10<U+00A0>% zu. In 11 Kantonen ver<e4>nderte sich die Inzidenz mit <U+00B1><U+00A0>10<U+00A0>% wenig. In 5 Kantonen und im FL sanken die F<e4>lle um mehr als 10<U+00A0>%. Die Inzidenzrate der laborbest<e4>tigten F<e4>lle pro 100<U+00A0>000 Einw. und Tag blieb in der Mehrheit der Kantone in der Berichtswoche im Vergleich zur Vorwoche stabil. Nach steigenden Fallzahlen w<e4>hrend f<fc>nf Wochen in UR kam es in der Berichtswoche und der Vorwoche zu einer Stagnation.",202116,"2021-04-28_07-49-44","COVID19WeeklyReportText"
"cases-demography","In der Berichtswoche wiesen alle Altersklassen zwischen 10 und 59 Jahren je <fc>ber 2<U+00A0>000 laborbest<e4>tigte F<e4>lle auf. Bezogen auf die Bev<f6>lkerungszahl waren die Altersklassen zwischen 10 und 49 Jahren mit mehr als 200 F<e4>llen pro 100<U+00A0>000 Einw. und Woche am meisten betroffen. Die Inzidenzrate der gemeldeten F<e4>lle ist in der Berichtswoche in allen Altersklassen im Vergleich zur Vorwoche konstant geblieben (weniger als <U+00B1><U+00A0>10<U+00A0>%), ausser in der Altersklasse der 0- bis 9-J<e4>hrigen, in welcher sie um 19<U+00A0>% stieg. Am wenigsten betroffen waren die 80-J<e4>hrigen und <c4>lteren mit einer Inzidenzrate von 49 pro 100<U+00A0>000 Einw. und Woche. Bei den Altersklassen der 70-J<e4>hrigen und <c4>lteren stagnierten die Inzidenzraten der gemeldeten F<e4>lle seit Woche 09/2021, w<e4>hrend sie in den allen j<fc>ngeren Altersklassen tendenziell stiegen. Dies kann teilweise auf einen Impfeffekt zur<fc>ckzuf<fc>hren sein. Das Medianalter aller laborbest<e4>tigter COVID-19-F<e4>lle lag in der Berichtswoche bei 37 Jahren. Seit Woche 03/2021 bewegt sich das Medianalter zwischen 37 und 41 Jahren. Die Inzidenzrate der gemeldeten F<e4>lle unterschied sich in der Berichtswoche und der Vorwoche zwischen den Geschlechtern kaum.","Pour la semaine sous revue, plus de 2000<U+00A0>cas ont <e9>t<e9> confirm<e9>s en laboratoire pour chaque tranche d<U+0092><e2>ge entre 10 et 59<U+00A0>ans. Par rapport <e0> la population, les groupes de 10 <e0> 49<U+00A0>ans ont <e9>t<e9> les plus touch<e9>s, avec plus que 200<U+00A0>cas ou plus pour 100<U+00A0>000<U+00A0>habitants et par semaine. Par rapport <e0> la semaine pr<e9>c<e9>dente, le taux d<U+0092>incidence des cas d<e9>clar<e9>s durant la semaine sous revue est rest<e9> stable dans toutes les classes d<U+0092><e2>ge (moins de <U+00B1><U+00A0>10<U+00A0>%), sauf pour les 0 <e0> 9<U+00A0>ans, o<f9> il a augment<e9> de 19<U+00A0>%. Avec un taux d<U+0092>incidence de 49<U+00A0>cas pour 100<U+00A0>000<U+00A0>habitants et par semaine, les personnes de 80<U+00A0>ans et plus ont <e9>t<e9> les moins affect<e9>es. Les taux d<U+0092>incidence des cas d<e9>clar<e9>s ont stagn<e9> depuis la semaine<U+00A0>09/2021 pour les plus de 70<U+00A0>ans alors qu<U+0092>ils ont eu tendance <e0> augmenter dans les classes d<U+0092><e2>ge plus jeunes. Cette diff<e9>rence peut <ea>tre due en partie <e0> la vaccination. Pendant la semaine sous revue, l<U+0092><e2>ge m<e9>dian de tous les cas de COVID-19 confirm<e9>s en laboratoire est rest<e9> <e0> 37<U+00A0>ans. Depuis la semaine<U+00A0>03/2021, ce chiffre varie entre 37 et 41<U+00A0>ans. Il n<U+0092>y a gu<e8>re de diff<e9>rence dans le taux d<U+0092>incidence des cas d<e9>clar<e9>s entre les sexes durant la semaine sous revue tout comme la semaine pr<e9>c<e9>dente.","Nella settimana in rassegna, ciascuna delle fasce d<U+0092>et<e0> tra i 10 e i 59 anni ha registrato oltre 2<U+00A0>000 casi confermati in laboratorio. In rapporto all<U+0092>intera popolazione, le fasce d<U+0092>et<e0> tra i 10 e i 49 anni sono state quelle maggiormente colpite, con pi<f9> di 200 casi alla settimana per 100<U+00A0>000 abitanti. Nella settimana in rassegna, il tasso di incidenza dei casi dichiarati <e8> rimasto costante (meno di <U+00B1> 10<U+00A0>%) in tutte le fasce d<U+0092>et<e0>, tranne che in quella da 0 a 9 anni, nella quale <e8> aumentato del 19<U+00A0>%. La meno colpita <e8> stata quella dagli 80 anni in su, con un tasso di incidenza di 49 casi alla settimana per 100<U+00A0>000 abitanti. Nelle fasce d<U+0092>et<e0> dai 70 anni in su il tasso di incidenza dei casi dichiarati <e8> stagnante dalla settimana 09/2021, mentre in tutte le fasce d<U+0092>et<e0> pi<f9> giovani <e8> tendenzialmente salito. Ci<f2> pu<f2> essere parzialmente ascrivibile a un effetto della vaccinazione. Nella settimana in rassegna l<U+0092>et<e0> mediana di tutti i casi di COVID-19 confermati in laboratorio <e8> stata di 37 anni. Dalla settimana<U+00A0>03/2021 oscilla tra i 37 e i 41 anni. Nella settimana in rassegna e in quella precedente il tasso d<U+0092>incidenza dei casi dichiarati <e8> stato pressoch<e9> identico tra i generi.","In der Berichtswoche wiesen alle Altersklassen zwischen 10 und 59 Jahren je <fc>ber 2<U+00A0>000 laborbest<e4>tigte F<e4>lle auf. Bezogen auf die Bev<f6>lkerungszahl waren die Altersklassen zwischen 10 und 49 Jahren mit mehr als 200 F<e4>llen pro 100<U+00A0>000 Einw. und Woche am meisten betroffen. Die Inzidenzrate der gemeldeten F<e4>lle ist in der Berichtswoche in allen Altersklassen im Vergleich zur Vorwoche konstant geblieben (weniger als <U+00B1><U+00A0>10<U+00A0>%), ausser in der Altersklasse der 0- bis 9-J<e4>hrigen, in welcher sie um 19<U+00A0>% stieg. Am wenigsten betroffen waren die 80-J<e4>hrigen und <c4>lteren mit einer Inzidenzrate von 49 pro 100<U+00A0>000 Einw. und Woche. Bei den Altersklassen der 70-J<e4>hrigen und <c4>lteren stagnierten die Inzidenzraten der gemeldeten F<e4>lle seit Woche 09/2021, w<e4>hrend sie in den allen j<fc>ngeren Altersklassen tendenziell stiegen. Dies kann teilweise auf einen Impfeffekt zur<fc>ckzuf<fc>hren sein. Das Medianalter aller laborbest<e4>tigter COVID-19-F<e4>lle lag in der Berichtswoche bei 37 Jahren. Seit Woche 03/2021 bewegt sich das Medianalter zwischen 37 und 41 Jahren. Die Inzidenzrate der gemeldeten F<e4>lle unterschied sich in der Berichtswoche und der Vorwoche zwischen den Geschlechtern kaum.","In der Berichtswoche wiesen alle Altersklassen zwischen 10 und 59 Jahren je <fc>ber 2<U+00A0>000 laborbest<e4>tigte F<e4>lle auf. Bezogen auf die Bev<f6>lkerungszahl waren die Altersklassen zwischen 10 und 49 Jahren mit mehr als 200 F<e4>llen pro 100<U+00A0>000 Einw. und Woche am meisten betroffen. Die Inzidenzrate der gemeldeten F<e4>lle ist in der Berichtswoche in allen Altersklassen im Vergleich zur Vorwoche konstant geblieben (weniger als <U+00B1><U+00A0>10<U+00A0>%), ausser in der Altersklasse der 0- bis 9-J<e4>hrigen, in welcher sie um 19<U+00A0>% stieg. Am wenigsten betroffen waren die 80-J<e4>hrigen und <c4>lteren mit einer Inzidenzrate von 49 pro 100<U+00A0>000 Einw. und Woche. Bei den Altersklassen der 70-J<e4>hrigen und <c4>lteren stagnierten die Inzidenzraten der gemeldeten F<e4>lle seit Woche 09/2021, w<e4>hrend sie in den allen j<fc>ngeren Altersklassen tendenziell stiegen. Dies kann teilweise auf einen Impfeffekt zur<fc>ckzuf<fc>hren sein. Das Medianalter aller laborbest<e4>tigter COVID-19-F<e4>lle lag in der Berichtswoche bei 37 Jahren. Seit Woche 03/2021 bewegt sich das Medianalter zwischen 37 und 41 Jahren. Die Inzidenzrate der gemeldeten F<e4>lle unterschied sich in der Berichtswoche und der Vorwoche zwischen den Geschlechtern kaum.",202116,"2021-04-28_07-49-44","COVID19WeeklyReportText"
