"identifier","de","fr","it","rm","en","date","version","type"
"deaths-geography","In 11<U+00A0>Kantonen und im FL wurden in der Berichtswoche keine Todesf<e4>lle verzeichnet. Die Rate der Todesf<e4>lle lag in allen Kantonen und im FL zwischen 0 und 2,7 Todesf<e4>llen pro 100<U+00A0>000 Einw.","Dans 11<U+00A0>cantons et au Liechtenstein, aucun d<e9>c<e8>s n<U+0092>a <e9>t<e9> recens<e9> pour la semaine sous revue. Le taux d<U+0092>incidence des d<e9>c<e8>s (taux de mortalit<e9>) dans tous les cantons et au Liechtenstein variait entre z<e9>ro et 2,7<U+00A0>d<e9>c<e8>s pour 100<U+00A0>000<U+00A0>habitants par canton.","In 11 Cantoni e in FL non sono stati registrati decessi nella settimana in rassegna. Il tasso di decessi in tutti i Cantoni e in FL ha oscillato tra 0 e 2,7 decessi ogni 100<U+00A0>000 abitanti.","In 11<U+00A0>Kantonen und im FL wurden in der Berichtswoche keine Todesf<e4>lle verzeichnet. Die Rate der Todesf<e4>lle lag in allen Kantonen und im FL zwischen 0 und 2,7 Todesf<e4>llen pro 100<U+00A0>000 Einw.","In 11<U+00A0>Kantonen und im FL wurden in der Berichtswoche keine Todesf<e4>lle verzeichnet. Die Rate der Todesf<e4>lle lag in allen Kantonen und im FL zwischen 0 und 2,7 Todesf<e4>llen pro 100<U+00A0>000 Einw.",202119,"2021-05-19_08-01-08","COVID19WeeklyReportText"
"deaths-demography","F<fc>r die Berichtswoche wurden bisher f<fc>r die Altersklassen von 0 bis 39 Jahren keine Todesf<e4>lle gemeldet. Die meisten Todesf<e4>lle (33<U+00A0>%) wurden in der Altersklasse der 80-J<e4>hrigen und <c4>lteren verzeichnet. Die Inzidenzrate der Todesf<e4>lle nimmt mit steigendem Alter zu. Die Inzidenzrate der Todesf<e4>lle der 80-J<e4>hrigen und <c4>lteren sank seit ihrem H<f6>chststand mit <fc>ber 100 Todesf<e4>llen pro 100<U+00A0>000 Einw. in Woche 51/2020 kontinuierlich bis Woche 18/2021 auf weniger als 5 Todesf<e4>lle pro 100<U+00A0>000 Einw. Bei den 60- bis 79-J<e4>hrigen stagnierte sie seit Woche 09/2021. Das Medianalter aller verstorbenen Personen lag in der Berichtswoche bei 70 Jahren. Die Inzidenzrate der Todesf<e4>lle im Zusammenhang mit COVID-19 war in der gesamten Epidemie bei M<e4>nnern h<f6>her als bei Frauen.","Pour la semaine sous revue, aucun d<e9>c<e8>s n<U+0092>a jusqu<U+0092>ici <e9>t<e9> d<e9>clar<e9> pour les groupes d<U+0092><e2>ge entre 0 et 39<U+00A0>ans. La plupart des d<e9>c<e8>s (33<U+00A0>%) concernaient la classe d<U+0092><e2>ge des 80<U+00A0>ans et plus. Le taux d<U+0092>incidence des d<e9>c<e8>s (taux de mortalit<e9>) augmente avec l<U+0092><e2>ge. Le taux de mortalit<e9> des personnes de 80<U+00A0>ans et plus a baiss<e9> continuellement depuis le pic atteint en semaine<U+00A0>51/2020 (plus de 100<U+00A0>d<e9>c<e8>s pour 100<U+00A0>000<U+00A0>habitants) jusqu<U+0092><e0> la semaine<U+00A0>18/2021 (moins de 5<U+00A0>d<e9>c<e8>s pour 100<U+00A0>000<U+00A0>habitants). Celui des personnes entre 60 et 79<U+00A0>ans stagne <e9>galement depuis la semaine<U+00A0>09/2021. Durant la semaine sous revue, l<U+0092><e2>ge m<e9>dian de toutes les personnes d<e9>c<e9>d<e9>es se situait <e0> 70<U+00A0>ans. Le taux de mortalit<e9> en lien avec le COVID-19 <e9>tait plus <e9>lev<e9> pour les hommes que pour les femmes sur l<U+0092>ensemble de l<U+0092><e9>pid<e9>mie.","Per la settimana in rassegna non sono stati finora dichiarati decessi nella fascia d<U+0092>et<e0> tra gli 0 e i 39 anni. La maggior parte dei decessi (33<U+00A0>%) <e8> stata registrata nella fascia d<U+0092>et<e0> dagli 80 anni in su. Il tasso d<U+0092>incidenza dei decessi cresce con l<U+0092>aumentare dell<U+0092>et<e0>. Il tasso d<U+0092>incidenza dei decessi fra le persone dagli 80 anni in su ha continuato a diminuire, dopo il picco raggiunto nella settimana 51/2020, con oltre 100 decessi ogni 100<U+00A0>000 abitanti, fino alla settimana 18/2021, con meno di 5 decessi ogni 100<U+00A0>000 abitanti. Nelle fasce d<U+0092>et<e0> tra i 60 e i 79 anni <e8> stagnante dalla settimana 09/2021. Nella settimana in rassegna l<U+0092>et<e0> mediana di tutte le persone decedute <e8> stata di 70 anni. Durante l<U+0092>intera epidemia il tasso d<U+0092>incidenza dei decessi in relazione a COVID-19 <e8> stato superiore negli uomini rispetto alle donne.","F<fc>r die Berichtswoche wurden bisher f<fc>r die Altersklassen von 0 bis 39 Jahren keine Todesf<e4>lle gemeldet. Die meisten Todesf<e4>lle (33<U+00A0>%) wurden in der Altersklasse der 80-J<e4>hrigen und <c4>lteren verzeichnet. Die Inzidenzrate der Todesf<e4>lle nimmt mit steigendem Alter zu. Die Inzidenzrate der Todesf<e4>lle der 80-J<e4>hrigen und <c4>lteren sank seit ihrem H<f6>chststand mit <fc>ber 100 Todesf<e4>llen pro 100<U+00A0>000 Einw. in Woche 51/2020 kontinuierlich bis Woche 18/2021 auf weniger als 5 Todesf<e4>lle pro 100<U+00A0>000 Einw. Bei den 60- bis 79-J<e4>hrigen stagnierte sie seit Woche 09/2021. Das Medianalter aller verstorbenen Personen lag in der Berichtswoche bei 70 Jahren. Die Inzidenzrate der Todesf<e4>lle im Zusammenhang mit COVID-19 war in der gesamten Epidemie bei M<e4>nnern h<f6>her als bei Frauen.","F<fc>r die Berichtswoche wurden bisher f<fc>r die Altersklassen von 0 bis 39 Jahren keine Todesf<e4>lle gemeldet. Die meisten Todesf<e4>lle (33<U+00A0>%) wurden in der Altersklasse der 80-J<e4>hrigen und <c4>lteren verzeichnet. Die Inzidenzrate der Todesf<e4>lle nimmt mit steigendem Alter zu. Die Inzidenzrate der Todesf<e4>lle der 80-J<e4>hrigen und <c4>lteren sank seit ihrem H<f6>chststand mit <fc>ber 100 Todesf<e4>llen pro 100<U+00A0>000 Einw. in Woche 51/2020 kontinuierlich bis Woche 18/2021 auf weniger als 5 Todesf<e4>lle pro 100<U+00A0>000 Einw. Bei den 60- bis 79-J<e4>hrigen stagnierte sie seit Woche 09/2021. Das Medianalter aller verstorbenen Personen lag in der Berichtswoche bei 70 Jahren. Die Inzidenzrate der Todesf<e4>lle im Zusammenhang mit COVID-19 war in der gesamten Epidemie bei M<e4>nnern h<f6>her als bei Frauen.",202119,"2021-05-19_08-01-08","COVID19WeeklyReportText"
"tests-summary","In der Berichtswoche wurden 183<U+00A0>486 Tests (72<U+00A0>% PCR und 28<U+00A0>% Antigen-Schnelltests) gemeldet. Dies waren etwa gleich viele Tests wie in der Vorwoche (+3,6<U+00A0>%).","Pendant la semaine sous revue, 183<U+00A0>486 tests (dont 72<U+00A0>% de tests PCR et 28<U+00A0>% de tests rapides antig<e9>niques) ont <e9>t<e9> d<e9>clar<e9>s, soit un nombre similaire <e0> la semaine pr<e9>c<e9>dente (+3,6<U+00A0>%).","Nella settimana in rassegna sono stati dichiarati 183<U+00A0>486 test (di cui il 72<U+00A0>% test PCR e il 28<U+00A0>% test antigenici rapidi), ossia un numero pressoch<e9> uguale (+3,6<U+00A0>%) rispetto alla settimana precedente.","In der Berichtswoche wurden 183<U+00A0>486 Tests (72<U+00A0>% PCR und 28<U+00A0>% Antigen-Schnelltests) gemeldet. Dies waren etwa gleich viele Tests wie in der Vorwoche (+3,6<U+00A0>%).","In der Berichtswoche wurden 183<U+00A0>486 Tests (72<U+00A0>% PCR und 28<U+00A0>% Antigen-Schnelltests) gemeldet. Dies waren etwa gleich viele Tests wie in der Vorwoche (+3,6<U+00A0>%).",202119,"2021-05-19_08-01-08","COVID19WeeklyReportText"
"tests-geography","In 4 Kantonen hat die Anzahl gemeldeter Tests in der Berichtswoche im Vergleich zur Vorwoche um mindestens 10<U+00A0>% zugenommen. In 16 Kantonen und im FL ver<e4>nderte sie sich weniger als <U+00B1>10<U+00A0>%. In 6 Kantonen nahm die Anzahl gemeldeter Tests um mehr als 10<U+00A0>% ab. Die Inzidenzrate gemeldeter Tests lag in den Kantonen und im FL zwischen 1425 pro 100<U+00A0>000 Einw. und Woche in SG und 4880 in UR. Pro Person sind mehrere positive und negative Tests m<f6>glich.","Dans 4<U+00A0>cantons, le nombre de tests d<e9>clar<e9>s a augment<e9> d<U+0092>au moins 10<U+00A0>% pendant la semaine sous revue par rapport <e0> la semaine pr<e9>c<e9>dente. Dans 16<U+00A0>cantons et au Liechtenstein, le nombre des tests a vari<e9> de moins de <U+00B1>10<U+00A0>%. Le nombre de tests d<e9>clar<e9>s a diminu<e9> de plus de 10<U+00A0>% dans 6<U+00A0>cantons. Dans les cantons et au Liechtenstein, le taux d<U+0092>incidence des tests d<e9>clar<e9>s a vari<e9>, pour 100<U+00A0>000<U+00A0>habitants et par semaine, entre 1<U+00A0>425 pour SG et 4<U+00A0>880 pour UR. Plusieurs tests positifs ou n<e9>gatifs sont possibles chez la m<ea>me personne.","In 4<U+00A0>Cantoni il numero di test dichiarati nella settimana in rassegna <e8> aumentato almeno del 10<U+00A0>% rispetto alla settimana precedente. In 16 Cantoni e in FL <e8> variato di meno di <U+00B1>10<U+00A0>%. In 6 Cantoni <e8> diminuito di pi<f9> del 10<U+00A0>%. Il tasso d<U+0092>incidenza dei test dichiarati nei Cantoni e in FL ha oscillato tra i 1<U+00A0>425 alla settimana per 100<U+00A0>000 abitanti in SG e i 4<U+00A0>880 in UR. Per la stessa persona possono risultare positivi o negativi pi<f9> test.","In 4 Kantonen hat die Anzahl gemeldeter Tests in der Berichtswoche im Vergleich zur Vorwoche um mindestens 10<U+00A0>% zugenommen. In 16 Kantonen und im FL ver<e4>nderte sie sich weniger als <U+00B1>10<U+00A0>%. In 6 Kantonen nahm die Anzahl gemeldeter Tests um mehr als 10<U+00A0>% ab. Die Inzidenzrate gemeldeter Tests lag in den Kantonen und im FL zwischen 1425 pro 100<U+00A0>000 Einw. und Woche in SG und 4880 in UR. Pro Person sind mehrere positive und negative Tests m<f6>glich.","In 4 Kantonen hat die Anzahl gemeldeter Tests in der Berichtswoche im Vergleich zur Vorwoche um mindestens 10<U+00A0>% zugenommen. In 16 Kantonen und im FL ver<e4>nderte sie sich weniger als <U+00B1>10<U+00A0>%. In 6 Kantonen nahm die Anzahl gemeldeter Tests um mehr als 10<U+00A0>% ab. Die Inzidenzrate gemeldeter Tests lag in den Kantonen und im FL zwischen 1425 pro 100<U+00A0>000 Einw. und Woche in SG und 4880 in UR. Pro Person sind mehrere positive und negative Tests m<f6>glich.",202119,"2021-05-19_08-01-08","COVID19WeeklyReportText"
"tests-share_of_positive_tests","Schweizweit (inkl. FL) ist der Anteil positiver PCR-Tests in der Berichtswoche im Vergleich zur Vorwoche von 7,2<U+00A0>% auf 5,4<U+00A0>% gesunken, <e4>hnlich sank der Anteil positiver Antigen-Schnelltests von 4,1<U+00A0>% auf 3,0<U+00A0>%. Der Anteil positiver PCR- sowie Antigen-Schnelltests lag in der Berichtswoche in fast allen Kantonen und dem FL unter 10<U+00A0>%.","En Suisse et au Liechtenstein, la proportion de r<e9>sultats positifs a diminu<e9> par rapport <e0> la semaine pr<e9>c<e9>dente pour les tests PCR (de 7,2 % <e0> 5,4<U+00A0>%) et pour les tests rapides antig<e9>niques (de 4,1<U+00A0>% <e0> 3,0<U+00A0>%). La proportion de r<e9>sultats positifs (tests PCR et tests rapides antig<e9>niques) <e9>tait inf<e9>rieure <e0> 10<U+00A0>% dans presque tous les cantons et au Liechtenstein durant la semaine sous revue.","In tutta la Svizzera (incl. FL) la percentuale di test PCR positivi nella settimana in rassegna <e8> scesa dal 7,2<U+00A0>% al 5,4<U+00A0>% rispetto alla settimana precedente, cos<ec> come quella dei test antigenici rapidi (dal 4,1<U+00A0>% al 3,0<U+00A0>%). Nella settimana in rassegna, la percentuale di test PCR e test antigenici rapidi positivi era inferiore al 10<U+00A0>% in quasi tutti i Cantoni e in FL.","Schweizweit (inkl. FL) ist der Anteil positiver PCR-Tests in der Berichtswoche im Vergleich zur Vorwoche von 7,2<U+00A0>% auf 5,4<U+00A0>% gesunken, <e4>hnlich sank der Anteil positiver Antigen-Schnelltests von 4,1<U+00A0>% auf 3,0<U+00A0>%. Der Anteil positiver PCR- sowie Antigen-Schnelltests lag in der Berichtswoche in fast allen Kantonen und dem FL unter 10<U+00A0>%.","Schweizweit (inkl. FL) ist der Anteil positiver PCR-Tests in der Berichtswoche im Vergleich zur Vorwoche von 7,2<U+00A0>% auf 5,4<U+00A0>% gesunken, <e4>hnlich sank der Anteil positiver Antigen-Schnelltests von 4,1<U+00A0>% auf 3,0<U+00A0>%. Der Anteil positiver PCR- sowie Antigen-Schnelltests lag in der Berichtswoche in fast allen Kantonen und dem FL unter 10<U+00A0>%.",202119,"2021-05-19_08-01-08","COVID19WeeklyReportText"
"tests-demography","In der Berichtswoche wurden in der Altersklasse der 30 bis 49-J<e4>hrigen <fc>ber 30<U+00A0>000 Tests gemeldet. Dies beinhaltet PCR-Tests sowie Antigen-Schnelltests. Bezogen auf die Bev<f6>lkerungszahl wurden in den Altersklassen der 20- bis 39-J<e4>hrigen mit jeweils <fc>ber 2500 pro 100<U+00A0>000 Einw. die meisten Tests gemeldet. Im Vergleich zur Vorwoche ver<e4>nderte sich die Anzahl der gemeldeten Tests in allen Altersklassen um weniger als <U+00B1>10<U+00A0>%. Das Medianalter der getesteten Personen lag bei 39 Jahren. Seit Woche 09/2021 bewegt sich das Medianalter zwischen 38 und 40 Jahren. Die Inzidenzrate der Tests unterschied sich in der Berichtswoche und der Vorwoche zwischen den Geschlechtern kaum.","Durant la semaine sous revue, plus de 30<U+00A0>000<U+00A0>tests ont <e9>t<e9> d<e9>clar<e9>s pour les tranches d<U+0092><e2>ge entre 30 et 49<U+00A0>ans). Ce chiffre comprend les tests PCR et les tests rapides antig<e9>niques. Par rapport <e0> la population, les classes d<U+0092><e2>ge de 20 <e0> 39<U+00A0>ans ont <e9>t<e9> les plus concern<e9>es avec, dans chaque groupe, plus de 2<U+00A0>500<U+00A0>tests d<e9>clar<e9>s pour 100<U+00A0>000<U+00A0>habitants. En comparaison avec la semaine pr<e9>c<e9>dente, le nombre de tests d<e9>clar<e9>s est rest<e9> stable dans toutes les classes d<U+0092><e2>ge (moins de <U+00B1>10<U+00A0>%). L<U+0092><e2>ge m<e9>dian des personnes test<e9>es <e9>tait de 39<U+00A0>ans. Depuis la semaine<U+00A0>09, ce chiffre varie entre 38 et 40<U+00A0>ans. Il n'y a gu<e8>re de diff<e9>rence dans le taux de d<e9>pistage entre les sexes durant la semaine sous revue et la semaine pr<e9>c<e9>dente.","Nella settimana in rassegna, nella fascia d<U+0092>et<e0> tra i 30 e i 49 anni sono stati dichiarati oltre 30<U+00A0>000 test. Tale cifra comprende sia i test PCR sia i test antigenici rapidi. In rapporto all<U+0092>intera popolazione, le fasce d<U+0092>et<e0> tra i 20 e i 39 anni sono state quelle in cui <e8> stato dichiarato il maggior numero di test, ciascuna con oltre 2<U+00A0>500 test alla settimana. Rispetto alla settimana precedente, la variazione del numero di test dichiarati <e8> stata inferiore a <U+00B1><U+00A0>10<U+00A0>% in tutte le fasce d<U+0092>et<e0>. L<U+0092>et<e0> mediana delle persone sottoposte a test <e8> stata di 39 anni. Dalla settimana 09/2021 oscilla tra i 38 e i 40 anni. Nella settimana in rassegna e in quella precedente il tasso di test <e8> stato pressoch<e9> identico tra i generi.","In der Berichtswoche wurden in der Altersklasse der 30 bis 49-J<e4>hrigen <fc>ber 30<U+00A0>000 Tests gemeldet. Dies beinhaltet PCR-Tests sowie Antigen-Schnelltests. Bezogen auf die Bev<f6>lkerungszahl wurden in den Altersklassen der 20- bis 39-J<e4>hrigen mit jeweils <fc>ber 2500 pro 100<U+00A0>000 Einw. die meisten Tests gemeldet. Im Vergleich zur Vorwoche ver<e4>nderte sich die Anzahl der gemeldeten Tests in allen Altersklassen um weniger als <U+00B1>10<U+00A0>%. Das Medianalter der getesteten Personen lag bei 39 Jahren. Seit Woche 09/2021 bewegt sich das Medianalter zwischen 38 und 40 Jahren. Die Inzidenzrate der Tests unterschied sich in der Berichtswoche und der Vorwoche zwischen den Geschlechtern kaum.","In der Berichtswoche wurden in der Altersklasse der 30 bis 49-J<e4>hrigen <fc>ber 30<U+00A0>000 Tests gemeldet. Dies beinhaltet PCR-Tests sowie Antigen-Schnelltests. Bezogen auf die Bev<f6>lkerungszahl wurden in den Altersklassen der 20- bis 39-J<e4>hrigen mit jeweils <fc>ber 2500 pro 100<U+00A0>000 Einw. die meisten Tests gemeldet. Im Vergleich zur Vorwoche ver<e4>nderte sich die Anzahl der gemeldeten Tests in allen Altersklassen um weniger als <U+00B1>10<U+00A0>%. Das Medianalter der getesteten Personen lag bei 39 Jahren. Seit Woche 09/2021 bewegt sich das Medianalter zwischen 38 und 40 Jahren. Die Inzidenzrate der Tests unterschied sich in der Berichtswoche und der Vorwoche zwischen den Geschlechtern kaum.",202119,"2021-05-19_08-01-08","COVID19WeeklyReportText"
"overview-short_description","Im Vergleich zur Vorwoche stagnierten in der Berichtswoche (Woche 20/2021) die Zahlen der gemeldeten Flle, der Hospitalisationen und der Tests. Die Zahl der gemeldeten Todesflle verblieb in der Berichtswoche auf tiefem Niveau.","En comparaison avec la semaine prcdente, le nombre de cas, dhospitalisations et de tests dclars est rest stable pendant la semaine sous revue (semaine20/2021). Quant au nombre de dcs dclars, il sest maintenu  un faible niveau.","Rispetto alla settimana precedente, nella settimana in rassegna (settimana 20/2021) il numero di casi dichiarati, ricoveri ospedalieri e test  rimasto stagnante, mentre il numero di decessi dichiarati  rimasto a un livello basso.","Im Vergleich zur Vorwoche stagnierten in der Berichtswoche (Woche 20/2021) die Zahlen der gemeldeten Flle, der Hospitalisationen und der Tests. Die Zahl der gemeldeten Todesflle verblieb in der Berichtswoche auf tiefem Niveau.","Im Vergleich zur Vorwoche stagnierten in der Berichtswoche (Woche 20/2021) die Zahlen der gemeldeten Flle, der Hospitalisationen und der Tests. Die Zahl der gemeldeten Todesflle verblieb in der Berichtswoche auf tiefem Niveau.",202120,"2021-05-26_07-56-34","COVID19WeeklyReportText"
"overview-cases","Fr die Berichtswoche wurden insgesamt 7336 laborbesttigte Flle gemeldet. Somit blieb die Anzahl gemeldeter Flle bei 7841 in der Vorwoche (-6,4%) in der Berichtswoche etwa gleich. Die Inzidenz der laborbesttigten Flle in den Kantonen und im FL lag zwischen 31 Fllen pro 100000 Einwohnerinnen und Einwohnern und Woche im FL und 409 in AI.","Pour la semaine sous revue, un total de 7336 cas confirms en laboratoire a t dclar, marquant ainsi une stagnation par rapport aux 7841 cas dclars de la semaine prcdente (-6,4%). Lincidence des cas confirms en laboratoire dans les cantons et le Liechtenstein tait comprise entre 31cas pour 100000habitants par semaine au Liechtenstein et 409  AI.","Per la settimana in rassegna sono stati dichiarati complessivamente 7336 casi confermati in laboratorio, per cui il numero di casi dichiarati  rimasto pressoch uguale rispetto ai 7841 della settimana precedente (6,4%). Lincidenza dei casi confermati in laboratorio nei Cantoni e in FL ha oscillato tra i 31 casi alla settimana per 100000 abitanti in FL e i 409 in AI.","Fr die Berichtswoche wurden insgesamt 7336 laborbesttigte Flle gemeldet. Somit blieb die Anzahl gemeldeter Flle bei 7841 in der Vorwoche (-6,4%) in der Berichtswoche etwa gleich. Die Inzidenz der laborbesttigten Flle in den Kantonen und im FL lag zwischen 31 Fllen pro 100000 Einwohnerinnen und Einwohnern und Woche im FL und 409 in AI.","Fr die Berichtswoche wurden insgesamt 7336 laborbesttigte Flle gemeldet. Somit blieb die Anzahl gemeldeter Flle bei 7841 in der Vorwoche (-6,4%) in der Berichtswoche etwa gleich. Die Inzidenz der laborbesttigten Flle in den Kantonen und im FL lag zwischen 31 Fllen pro 100000 Einwohnerinnen und Einwohnern und Woche im FL und 409 in AI.",202120,"2021-05-26_07-56-34","COVID19WeeklyReportText"
"overview-hospitalisations","Fr die Berichtswoche wurden bisher 193 Hospitalisationen im Zusammenhang mit einer laborbesttigten COVID-19-Erkrankung gemeldet. In der Vorwoche waren es zum selben Zeitpunkt 195 gemeldete Hospitalisationen. Somit stagniert die Zahl der Hospitalisationen voraussichtlich im Vergleich zur Vorwoche. Die durchschnittliche Zahl der Patientinnen und Patienten mit einer COVID-19-Erkrankung auf einer Intensivpflegestation lag in der Berichtswoche bei 172 Personen im Vergleich zu 198 in der Vorwoche.","Jusquici, 193 hospitalisations en lien avec un COVID-19 confirm en laboratoire ont t dclares pour la semaine sous revue. La semaine prcdente, au mme moment, leur nombre tait de 195. Le nombre dhospitalisations devrait donc stagner par rapport  la semaine prcdente. Le nombre moyen de patients atteints du COVID-19 hospitaliss dans une unit de soins intensifs tait de 172 pendant la semaine sous revue contre 198 la semaine prcdente.","Per la settimana in rassegna, finora sono stati dichiarati 193 ricoveri per COVID-19 confermata in laboratorio, contro i 195 dichiarati nello stesso momento della settimana precedente. Quindi il numero di ricoveri nella settimana in rassegna rimarr probabilmente stagnante rispetto a quello della settimana precedente. Il numero medio di pazienti ricoverati per COVID-19 in un reparto di cure intense nella settimana in rassegna  stato di 172, contro i 198 della settimana precedente.","Fr die Berichtswoche wurden bisher 193 Hospitalisationen im Zusammenhang mit einer laborbesttigten COVID-19-Erkrankung gemeldet. In der Vorwoche waren es zum selben Zeitpunkt 195 gemeldete Hospitalisationen. Somit stagniert die Zahl der Hospitalisationen voraussichtlich im Vergleich zur Vorwoche. Die durchschnittliche Zahl der Patientinnen und Patienten mit einer COVID-19-Erkrankung auf einer Intensivpflegestation lag in der Berichtswoche bei 172 Personen im Vergleich zu 198 in der Vorwoche.","Fr die Berichtswoche wurden bisher 193 Hospitalisationen im Zusammenhang mit einer laborbesttigten COVID-19-Erkrankung gemeldet. In der Vorwoche waren es zum selben Zeitpunkt 195 gemeldete Hospitalisationen. Somit stagniert die Zahl der Hospitalisationen voraussichtlich im Vergleich zur Vorwoche. Die durchschnittliche Zahl der Patientinnen und Patienten mit einer COVID-19-Erkrankung auf einer Intensivpflegestation lag in der Berichtswoche bei 172 Personen im Vergleich zu 198 in der Vorwoche.",202120,"2021-05-26_07-56-34","COVID19WeeklyReportText"
"overview-deaths","Fr die Berichtswoche wurden dem BAG bisher 23 Todesflle im Zusammenhang mit einer laborbesttigten COVID-19-Erkrankung gemeldet. In der Vorwoche waren es zum selben Zeitpunkt 27 gemeldete Todesflle. Die gemeldeten Todesfllen verbleiben somit auf tiefem Niveau.","Pour la semaine sous revue, 23dcs en lien avec un COVID-19 confirm en laboratoire ont t enregistrs jusquici. La semaine prcdente, au mme moment, leur nombre tait de 27. Le nombre de dcs dclars se maintient donc  un faible niveau.","Per la settimana in rassegna, sono finora stati dichiarati allUFSP 23 decessi in relazione a COVID-19 confermata in laboratorio. Fino allo stesso momento della settimana precedente ne sono stati dichiarati 27. Il numero di decessi dichiarati rimane quindi a un livello basso.","Fr die Berichtswoche wurden dem BAG bisher 23 Todesflle im Zusammenhang mit einer laborbesttigten COVID-19-Erkrankung gemeldet. In der Vorwoche waren es zum selben Zeitpunkt 27 gemeldete Todesflle. Die gemeldeten Todesfllen verbleiben somit auf tiefem Niveau.","Fr die Berichtswoche wurden dem BAG bisher 23 Todesflle im Zusammenhang mit einer laborbesttigten COVID-19-Erkrankung gemeldet. In der Vorwoche waren es zum selben Zeitpunkt 27 gemeldete Todesflle. Die gemeldeten Todesfllen verbleiben somit auf tiefem Niveau.",202120,"2021-05-26_07-56-34","COVID19WeeklyReportText"
"overview-tests","In der Berichtswoche wurden 199823 Tests (68% PCR und 32% Antigen-Schnelltests) gemeldet. Im Vergleich zur Vorwoche ist die Anzahl Tests mit +8,9% in etwa gleich geblieben. Der Anteil positiver PCR-Tests ist etwa gleich geblieben (5,0% im Vergleich zu 5,4% in der Vorwoche), wobei der Anteil positiver Antigen-Schnelltests von 3,0% auf 2,1% gesunken ist. Pro Person sind mehrere positive und negative Tests mglich.","Au cours de la semaine sous revue, 199823 tests (68% de tests PCR et 32% de tests rapides antigniques) ont t dclars. Par rapport  la semaine prcdente, le nombre de tests est rest stable (+8,9%). La proportion de rsultats positifs est reste stable pour les tests PCR (5,0% contre 5,4% la semaine prcdente) et a diminu pour les tests rapides antigniques (de 3,0%  2,1%). Plusieurs tests positifs ou ngatifs sont possibles chez la mme personne.","Nella settimana in rassegna sono stati dichiarati 199823 test (68% PCR e 32% test antigenici rapidi), un numero che, con un +8,9%,  rimasto pressoch uguale rispetto alla settimana precedente. La percentuale dei test PCR positivi  rimasta pressoch uguale (5,0% a fronte di un 5,4% nella settimana precedente), con un calo dei test antigenici rapidi risultati positivi (scesi dal 3,0% al 2,1%). Per la stessa persona possono risultare positivi o negativi pi test.","In der Berichtswoche wurden 199823 Tests (68% PCR und 32% Antigen-Schnelltests) gemeldet. Im Vergleich zur Vorwoche ist die Anzahl Tests mit +8,9% in etwa gleich geblieben. Der Anteil positiver PCR-Tests ist etwa gleich geblieben (5,0% im Vergleich zu 5,4% in der Vorwoche), wobei der Anteil positiver Antigen-Schnelltests von 3,0% auf 2,1% gesunken ist. Pro Person sind mehrere positive und negative Tests mglich.","In der Berichtswoche wurden 199823 Tests (68% PCR und 32% Antigen-Schnelltests) gemeldet. Im Vergleich zur Vorwoche ist die Anzahl Tests mit +8,9% in etwa gleich geblieben. Der Anteil positiver PCR-Tests ist etwa gleich geblieben (5,0% im Vergleich zu 5,4% in der Vorwoche), wobei der Anteil positiver Antigen-Schnelltests von 3,0% auf 2,1% gesunken ist. Pro Person sind mehrere positive und negative Tests mglich.",202120,"2021-05-26_07-56-34","COVID19WeeklyReportText"
