"identifier","de","fr","it","rm","en","date","version","type"
"cases-geography","Die Inzidenzrate lag in der Berichtswoche in 18 Kantonen bei <fc>ber 100 F<e4>llen pro 100<U+00A0>000 Einw. und Woche. Insgesamt lag die Inzidenzrate der laborbest<e4>tigten F<e4>lle in der Schweiz und in Liechtenstein zwischen 77 F<e4>llen pro 100<U+00A0>000 Einw. und Woche im FL und 343 in UR. In 15 Kantonen und im FL nahm die Inzidenzrate um mehr als 10<U+00A0>% ab. In 10 Kantonen ver<e4>nderte sich die Inzidenzrate mit <U+00B1>10<U+00A0>% wenig. Nur in einem kleinen Kanton stieg die Inzidenzrate um mehr als 10<U+00A0>%. In der Mehrheit der Kantone sank die Inzidenzrate der laborbest<e4>tigten F<e4>lle pro 100 000 Einw. und Tag <fc>ber die letzten 4 Wochen tendenziell.","Pour la semaine sous revue, le taux d<U+0092>incidence <e9>tait, pour 100<U+00A0>000<U+00A0>habitants et par semaine, sup<e9>rieur <e0> 100<U+00A0>cas dans 18<U+00A0>cantons. Le taux d<U+0092>incidence des cas confirm<e9>s en laboratoire en Suisse et au Liechtenstein variait, pour 100<U+00A0>000<U+00A0>habitants et par semaine, entre 77 cas au Liechtenstein et 343 <e0> UR. Dans 15<U+00A0>cantons et au Liechtenstein, le taux d<U+0092>incidence a diminu<e9> de plus de 10<U+00A0>%. Dans 10<U+00A0>cantons, il n<U+0092>a que peu chang<e9> (<U+00B1>10<U+00A0>%). Il a augment<e9> de plus de 10<U+00A0>% dans un seul petit canton. Dans la majorit<e9> des cantons, le taux d<U+0092>incidence des cas confirm<e9>s en laboratoire pour 100<U+00A0>000<U+00A0>habitants et par jour a eu tendance <e0> diminuer durant les quatre derni<e8>res semaines.","Nella settimana in rassegna, il tasso di incidenza ha superato i 100 casi alla settimana per 100<U+00A0>000 abitanti in 18 Cantoni. Nel complesso, il tasso di incidenza dei casi confermati in laboratorio in Svizzera e in FL ha oscillato tra i 77 casi alla settimana per 100<U+00A0>000 abitanti in FL e i 343 in UR. In 15 Cantoni e in FL il tasso di incidenza <e8> diminuito di pi<f9> del 10<U+00A0>%. In 10 Cantoni il tasso di incidenza <e8> variato poco, con un <U+00B1>10<U+00A0>%. Soltanto in un piccolo Cantone <e8> aumentato di pi<f9> del 10<U+00A0>%. Il tasso di incidenza dei casi confermati in laboratorio per 100<U+00A0>000 abitanti e per giorno <e8> tendenzialmente sceso nelle ultime 4 settimane nella maggior parte dei Cantoni.","Die Inzidenzrate lag in der Berichtswoche in 18 Kantonen bei <fc>ber 100 F<e4>llen pro 100<U+00A0>000 Einw. und Woche. Insgesamt lag die Inzidenzrate der laborbest<e4>tigten F<e4>lle in der Schweiz und in Liechtenstein zwischen 77 F<e4>llen pro 100<U+00A0>000 Einw. und Woche im FL und 343 in UR. In 15 Kantonen und im FL nahm die Inzidenzrate um mehr als 10<U+00A0>% ab. In 10 Kantonen ver<e4>nderte sich die Inzidenzrate mit <U+00B1>10<U+00A0>% wenig. Nur in einem kleinen Kanton stieg die Inzidenzrate um mehr als 10<U+00A0>%. In der Mehrheit der Kantone sank die Inzidenzrate der laborbest<e4>tigten F<e4>lle pro 100 000 Einw. und Tag <fc>ber die letzten 4 Wochen tendenziell.","Die Inzidenzrate lag in der Berichtswoche in 18 Kantonen bei <fc>ber 100 F<e4>llen pro 100<U+00A0>000 Einw. und Woche. Insgesamt lag die Inzidenzrate der laborbest<e4>tigten F<e4>lle in der Schweiz und in Liechtenstein zwischen 77 F<e4>llen pro 100<U+00A0>000 Einw. und Woche im FL und 343 in UR. In 15 Kantonen und im FL nahm die Inzidenzrate um mehr als 10<U+00A0>% ab. In 10 Kantonen ver<e4>nderte sich die Inzidenzrate mit <U+00B1>10<U+00A0>% wenig. Nur in einem kleinen Kanton stieg die Inzidenzrate um mehr als 10<U+00A0>%. In der Mehrheit der Kantone sank die Inzidenzrate der laborbest<e4>tigten F<e4>lle pro 100 000 Einw. und Tag <fc>ber die letzten 4 Wochen tendenziell.",202118,"2021-05-12_07-47-53","COVID19WeeklyReportText"
"cases-demography","In der Berichtswoche wiesen alle Altersklassen der 10- bis 59-J<e4>hrigen je <fc>ber 1<U+00A0>500 laborbest<e4>tigte F<e4>lle auf. Bezogen auf die Bev<f6>lkerungszahl war die Altersklasse der 10- bis 19J<e4>hrigen mit fast 200 F<e4>llen pro 100<U+00A0>000 Einw. und Woche am meisten betroffen. Die Inzidenzrate der gemeldeten F<e4>lle ist in der Berichtswoche im Vergleich zur Vorwoche bei den 20-J<e4>hrigen und <c4>lteren um mehr als 10<U+00A0>% gesunken. In den Altersklassen der unter 20-J<e4>hrigen ver<e4>nderte sie sich um weniger als <U+00B1>10<U+00A0>%. Am wenigsten betroffen waren die 80-J<e4>hrigen und <c4>lteren mit einer Inzidenzrate von 34 pro 100<U+00A0>000 Einw. und Woche. In dieser Altersklasse stagnierte die Inzidenzrate der gemeldeten F<e4>lle seit Woche 09/2021 und sank nun deutlich. In den Altersklassen der unter 80-J<e4>hrigen sanken die Fallzahlen seit Woche 17/2021 ebenfalls wieder, nachdem sie zuvor w<e4>hrend mehrerer Wochen tendenziell gestiegen waren. Das Medianalter aller laborbest<e4>tigter COVID-19-F<e4>lle lag in der Berichtswoche bei 36 Jahren und seit Woche 10/2021 unter 40 Jahren. Die Inzidenzrate der gemeldeten F<e4>lle unterschied sich in der Berichtswoche und der Vorwoche zwischen den Geschlechtern kaum.","Pour la semaine sous revue, plus de 1<U+00A0>500<U+00A0>cas ont <e9>t<e9> confirm<e9>s en laboratoire pour chaque classe d<U+0092><e2>ge entre 10 et 59<U+00A0>ans. Par rapport <e0> la population, le groupe de 10 <e0> 19<U+00A0>ans a <e9>t<e9> le plus touch<e9>, avec presque 200<U+00A0>cas pour 100<U+00A0>000<U+00A0>habitants et par semaine. Par rapport <e0> la semaine pr<e9>c<e9>dente, le taux d<U+0092>incidence des cas d<e9>clar<e9>s durant la semaine sous revue a diminu<e9> de plus de 10<U+00A0>% chez les personnes de plus de 20<U+00A0>ans. Dans les tranches d<U+0092><e2>ge inf<e9>rieures <e0> 20<U+00A0>ans, il a vari<e9> de moins de <U+00B1>10<U+00A0>%. Avec un taux d<U+0092>incidence de 34<U+00A0>cas pour 100<U+00A0>000<U+00A0>habitants et par semaine, les personnes de 80<U+00A0>ans et plus ont <e9>t<e9> les moins affect<e9>es. Apr<e8>s avoir stagn<e9> depuis la semaine 09/2021, le taux d<U+0092>incidence des cas d<e9>clar<e9>s dans cette classe d<U+0092><e2>ge a maintenant nettement diminu<e9>. Dans les classes d<U+0092><e2>ge des moins de 80<U+00A0>ans, les chiffres ont <e9>galement continu<e9> <e0> diminuer depuis la semaine 17/2021, apr<e8>s avoir eu tendance <e0> augmenter pendant plusieurs semaines. L<U+0092><e2>ge m<e9>dian de tous les cas de COVID-19 confirm<e9>s en laboratoire <e9>tait de 36<U+00A0>ans pendant la semaine sous revue et inf<e9>rieur <e0> 40 ans depuis la semaine<U+00A0>10/2021. Il n<U+0092>y a gu<e8>re de diff<e9>rence dans le taux d<U+0092>incidence des cas d<e9>clar<e9>s entre les sexes durant la semaine sous revue tout comme la semaine pr<e9>c<e9>dente.","Nella settimana in rassegna, ciascuna delle fasce d<U+0092>et<e0> tra i 10 e i 59 anni ha registrato oltre 1<U+00A0>500 casi confermati in laboratorio. In rapporto all<U+0092>intera popolazione, la fascia d<U+0092>et<e0> tra i 10 e i 19 anni <e8> stata quella maggiormente colpita, con quasi 200 casi alla settimana per 100<U+00A0>000 abitanti. Rispetto alla settimana precedente, nella settimana in rassegna il tasso di incidenza dei casi dichiarati <e8> sceso di pi<f9> del 10<U+00A0>% nelle fasce d<U+0092>et<e0> dai 20 anni in su ed <e8> variato di meno di <U+00B1>10<U+00A0>% nelle fasce d<U+0092>et<e0> sotto i 20 anni. La meno colpita <e8> stata la fascia d<U+0092>et<e0> dagli 80 anni in su, con un tasso di incidenza di 34 casi alla settimana per 100<U+00A0>000 abitanti. In questa fascia d<U+0092>et<e0> il tasso di incidenza dei casi dichiarati <e8> rimasto stagnante dalla settimana 09/2021 e ora <e8> sceso nettamente, nelle fasce d<U+0092>et<e0> sotto gli 80 anni il numero di casi <e8> nuovamente sceso dalla settimana 17/2021, dopo che in precedenza era tendenzialmente salito per diverse settimane. Nella settimana in rassegna l<U+0092>et<e0> mediana di tutti i casi di COVID-19 confermati in laboratorio <e8> stata di 36 anni e dalla settimana<U+00A0>10/2021 <e8> inferiore ai 40 anni. Nella settimana in rassegna e in quella precedente il tasso d<U+0092>incidenza dei casi dichiarati <e8> stato pressoch<e9> identico tra i generi.","In der Berichtswoche wiesen alle Altersklassen der 10- bis 59-J<e4>hrigen je <fc>ber 1<U+00A0>500 laborbest<e4>tigte F<e4>lle auf. Bezogen auf die Bev<f6>lkerungszahl war die Altersklasse der 10- bis 19J<e4>hrigen mit fast 200 F<e4>llen pro 100<U+00A0>000 Einw. und Woche am meisten betroffen. Die Inzidenzrate der gemeldeten F<e4>lle ist in der Berichtswoche im Vergleich zur Vorwoche bei den 20-J<e4>hrigen und <c4>lteren um mehr als 10<U+00A0>% gesunken. In den Altersklassen der unter 20-J<e4>hrigen ver<e4>nderte sie sich um weniger als <U+00B1>10<U+00A0>%. Am wenigsten betroffen waren die 80-J<e4>hrigen und <c4>lteren mit einer Inzidenzrate von 34 pro 100<U+00A0>000 Einw. und Woche. In dieser Altersklasse stagnierte die Inzidenzrate der gemeldeten F<e4>lle seit Woche 09/2021 und sank nun deutlich. In den Altersklassen der unter 80-J<e4>hrigen sanken die Fallzahlen seit Woche 17/2021 ebenfalls wieder, nachdem sie zuvor w<e4>hrend mehrerer Wochen tendenziell gestiegen waren. Das Medianalter aller laborbest<e4>tigter COVID-19-F<e4>lle lag in der Berichtswoche bei 36 Jahren und seit Woche 10/2021 unter 40 Jahren. Die Inzidenzrate der gemeldeten F<e4>lle unterschied sich in der Berichtswoche und der Vorwoche zwischen den Geschlechtern kaum.","In der Berichtswoche wiesen alle Altersklassen der 10- bis 59-J<e4>hrigen je <fc>ber 1<U+00A0>500 laborbest<e4>tigte F<e4>lle auf. Bezogen auf die Bev<f6>lkerungszahl war die Altersklasse der 10- bis 19J<e4>hrigen mit fast 200 F<e4>llen pro 100<U+00A0>000 Einw. und Woche am meisten betroffen. Die Inzidenzrate der gemeldeten F<e4>lle ist in der Berichtswoche im Vergleich zur Vorwoche bei den 20-J<e4>hrigen und <c4>lteren um mehr als 10<U+00A0>% gesunken. In den Altersklassen der unter 20-J<e4>hrigen ver<e4>nderte sie sich um weniger als <U+00B1>10<U+00A0>%. Am wenigsten betroffen waren die 80-J<e4>hrigen und <c4>lteren mit einer Inzidenzrate von 34 pro 100<U+00A0>000 Einw. und Woche. In dieser Altersklasse stagnierte die Inzidenzrate der gemeldeten F<e4>lle seit Woche 09/2021 und sank nun deutlich. In den Altersklassen der unter 80-J<e4>hrigen sanken die Fallzahlen seit Woche 17/2021 ebenfalls wieder, nachdem sie zuvor w<e4>hrend mehrerer Wochen tendenziell gestiegen waren. Das Medianalter aller laborbest<e4>tigter COVID-19-F<e4>lle lag in der Berichtswoche bei 36 Jahren und seit Woche 10/2021 unter 40 Jahren. Die Inzidenzrate der gemeldeten F<e4>lle unterschied sich in der Berichtswoche und der Vorwoche zwischen den Geschlechtern kaum.",202118,"2021-05-12_07-47-53","COVID19WeeklyReportText"
"hospitalisations-summary","F<fc>r die Berichtswoche sind bisher <fc>ber die gesamte Schweiz und Liechtenstein 280 neue Hospitalisationen mit einer laborbest<e4>tigten COVID-19-Erkrankung gemeldet worden. In der Vorwoche waren zum selben Zeitpunkt 381 Hospitalisationen gemeldet. Somit ist trotz der ausstehenden Nachmeldungen eine Abnahme der Anzahl Hospitalisationen zu erwarten.","Pour la semaine sous revue, 280<U+00A0>nouvelles hospitalisations en lien avec un COVID-19 confirm<e9> en laboratoire ont jusqu<U+0092>ici <e9>t<e9> d<e9>clar<e9>es pour la Suisse et le Liechtenstein. La semaine pr<e9>c<e9>dente, au m<ea>me moment, leur nombre <e9>tait de 381. Malgr<e9> d<e9>clarations tardives encore attendues, une baisse du nombre d<U+0092>hospitalisations est escompt<e9>e.","Nella settimana in rassegna sono stati dichiarati finora in tutta la Svizzera e in FL 280 nuovi ricoveri ospedalieri per COVID-19 confermata in laboratorio, contro i 381 dichiarati nello stesso momento della settimana precedente. Nonostante le dichiarazioni tardive ancora attese, <e8> quindi probabile una diminuzione del numero di ricoveri.","F<fc>r die Berichtswoche sind bisher <fc>ber die gesamte Schweiz und Liechtenstein 280 neue Hospitalisationen mit einer laborbest<e4>tigten COVID-19-Erkrankung gemeldet worden. In der Vorwoche waren zum selben Zeitpunkt 381 Hospitalisationen gemeldet. Somit ist trotz der ausstehenden Nachmeldungen eine Abnahme der Anzahl Hospitalisationen zu erwarten.","F<fc>r die Berichtswoche sind bisher <fc>ber die gesamte Schweiz und Liechtenstein 280 neue Hospitalisationen mit einer laborbest<e4>tigten COVID-19-Erkrankung gemeldet worden. In der Vorwoche waren zum selben Zeitpunkt 381 Hospitalisationen gemeldet. Somit ist trotz der ausstehenden Nachmeldungen eine Abnahme der Anzahl Hospitalisationen zu erwarten.",202118,"2021-05-12_07-47-53","COVID19WeeklyReportText"
"hospitalisations-geography","Die Entwicklung der Hospitalisationen in den Kantonen ist infolge der zu erwartenden Nachmeldungen erschwert einzusch<e4>tzen.","Du fait des d<e9>clarations tardives, l'<e9>volution des hospitalisations dans les cantons est difficile <e0> <e9>valuer.","L'evoluzione dei ricoveri ospedalieri nei cantoni <e8> difficile da stimare a causa dei rapporti dichiarazioni tardive.","Die Entwicklung der Hospitalisationen in den Kantonen ist infolge der zu erwartenden Nachmeldungen erschwert einzusch<e4>tzen.","Die Entwicklung der Hospitalisationen in den Kantonen ist infolge der zu erwartenden Nachmeldungen erschwert einzusch<e4>tzen.",202118,"2021-05-12_07-47-53","COVID19WeeklyReportText"
"hospitalisations-demography","F<fc>r die Berichtswoche wurden in allen Altersklassen Hospitalisationen im Zusammenhang mit COVID-19 gemeldet, wobei in den Altersklassen der 50- bis 79J<e4>hrigen jeweils mehr als 50 Hospitalisationen gemeldet wurden. In absoluten Zahlen wurden f<fc>r die Berichtswoche mit 66 Hospitalisationen die meisten Hospitalisationen in der Altersklasse der 50- bis 59-J<e4>hrigen gemeldet. In der Altersklasse der <fc>ber 80-J<e4>hrigen wurde die h<f6>chste Hospitalisationsrate beobachtet. Die Hospitalisationsrate bei den 80-J<e4>hrigen und <c4>lteren sank seit Anfang des Jahres 2021 kontinuierlich, mit Ausnahme von Woche 13/2021. Das Medianalter der hospitalisierten Personen lag in der Berichtswoche bei 61 Jahren. Seit Woche 10/2021 lag das Medianalter unter 70 Jahren. Die Hospitalisationsrate war in der Berichtswoche wie in der gesamten Epidemie bei M<e4>nnern h<f6>her als bei Frauen.","Pour la semaine sous revue, des hospitalisations li<e9>es au COVID-19 ont <e9>t<e9> d<e9>clar<e9>es pour toutes les classes d<U+0092><e2>ge. Il y a eu plus de 50<U+00A0>hospitalisations d<e9>clar<e9>es dans chaque classe d<U+0092><e2>ge entre 50 <e0> 79<U+00A0>ans. Le maximum des hospitalisations (en chiffres absolus) pour la semaine sous revue a <e9>t<e9> d<e9>clar<e9> dans la classe d<U+0092><e2>ge des 50 <e0> 59<U+00A0>ans, avec 66<U+00A0>hospitalisations. Le groupe d<U+0092><e2>ge des 80<U+00A0>ans et plus a enregistr<e9> le plus haut taux d<U+0092>incidence des hospitalisations. Le taux d<U+0092>incidence des hospitalisations chez les personnes de 80<U+00A0>ans et plus a baiss<e9> continuellement depuis le d<e9>but de l<U+0092>ann<e9>e 2021, <e0> l<U+0092>exception de la semaine 13. Durant la semaine sous revue, l<U+0092><e2>ge m<e9>dian des personnes hospitalis<e9>es <e9>tait de 61<U+00A0>ans. Depuis la semaine<U+00A0>10/2021, il est inf<e9>rieur <e0> 70<U+00A0>ans. Le taux d<U+0092>incidence des hospitalisations <e9>tait plus <e9>lev<e9> chez les hommes que chez les femmes pendant la semaine sous revue et sur l<U+0092>ensemble de l<U+0092><e9>pid<e9>mie.","Per la settimana in rassegna sono stati dichiarati ricoveri ospedalieri in relazione a COVID-19 in tutte le fasce d<U+0092>et<e0>; in quelle dai 50 e i 79 anni in su sono stati dichiarati rispettivamente pi<f9> di 50 ricoveri. In cifre assolute il maggior numero di ricoveri ospedalieri per la settimana in rassegna <e8> stato dichiarato nella fascia d<U+0092>et<e0> fra i 50 e i 59 anni, con 66 ricoveri. Nella fascia d<U+0092>et<e0> dagli 80 anni in su <e8> stato osservato il maggior tasso di ricoveri ospedalieri. Il tasso di ricoveri fra le persone dagli 80 anni in su <e8> in continua diminuzione dall<U+0092>inizio del 2021, eccezion fatta per la settimana 13/2021. Nella settimana in rassegna, l<U+0092>et<e0> mediana delle persone ricoverate in ospedale <e8> stata intorno ai 61 anni. Dalla settimana<U+00A0>10/2021 <e8> stata inferiore ai 70 anni. Nella settimana in rassegna e durante l<U+0092>intera epidemia il tasso di ricoveri ospedalieri <e8> stato superiore negli uomini rispetto alle donne.","F<fc>r die Berichtswoche wurden in allen Altersklassen Hospitalisationen im Zusammenhang mit COVID-19 gemeldet, wobei in den Altersklassen der 50- bis 79J<e4>hrigen jeweils mehr als 50 Hospitalisationen gemeldet wurden. In absoluten Zahlen wurden f<fc>r die Berichtswoche mit 66 Hospitalisationen die meisten Hospitalisationen in der Altersklasse der 50- bis 59-J<e4>hrigen gemeldet. In der Altersklasse der <fc>ber 80-J<e4>hrigen wurde die h<f6>chste Hospitalisationsrate beobachtet. Die Hospitalisationsrate bei den 80-J<e4>hrigen und <c4>lteren sank seit Anfang des Jahres 2021 kontinuierlich, mit Ausnahme von Woche 13/2021. Das Medianalter der hospitalisierten Personen lag in der Berichtswoche bei 61 Jahren. Seit Woche 10/2021 lag das Medianalter unter 70 Jahren. Die Hospitalisationsrate war in der Berichtswoche wie in der gesamten Epidemie bei M<e4>nnern h<f6>her als bei Frauen.","F<fc>r die Berichtswoche wurden in allen Altersklassen Hospitalisationen im Zusammenhang mit COVID-19 gemeldet, wobei in den Altersklassen der 50- bis 79J<e4>hrigen jeweils mehr als 50 Hospitalisationen gemeldet wurden. In absoluten Zahlen wurden f<fc>r die Berichtswoche mit 66 Hospitalisationen die meisten Hospitalisationen in der Altersklasse der 50- bis 59-J<e4>hrigen gemeldet. In der Altersklasse der <fc>ber 80-J<e4>hrigen wurde die h<f6>chste Hospitalisationsrate beobachtet. Die Hospitalisationsrate bei den 80-J<e4>hrigen und <c4>lteren sank seit Anfang des Jahres 2021 kontinuierlich, mit Ausnahme von Woche 13/2021. Das Medianalter der hospitalisierten Personen lag in der Berichtswoche bei 61 Jahren. Seit Woche 10/2021 lag das Medianalter unter 70 Jahren. Die Hospitalisationsrate war in der Berichtswoche wie in der gesamten Epidemie bei M<e4>nnern h<f6>her als bei Frauen.",202118,"2021-05-12_07-47-53","COVID19WeeklyReportText"
"deaths-summary","F<fc>r die Berichtswoche wurden bisher <fc>ber die gesamte Schweiz und Liechtenstein 35 (0,4 pro 100<U+00A0>000 Einw.) Todesf<e4>lle im Zusammenhang mit einer laborbest<e4>tigten COVID-19-Erkrankung gemeldet. Zum selben Zeitpunkt in der Vorwoche waren dies 60 Todesf<e4>lle. Somit ist trotz der ausstehenden Nachmeldungen eine Abnahme der Todesf<e4>lle in der Berichtswoche im Vergleich zur Vorwoche zu erwarten.","Durant la semaine sous revue, 35<U+00A0>d<e9>c<e8>s (0,4 pour 100<U+00A0>000<U+00A0>habitants) li<e9>s <e0> un COVID-19 confirm<e9> en laboratoire ont <e9>t<e9> d<e9>clar<e9>s jusqu<U+0092>ici pour la Suisse et le Liechtenstein. Au m<ea>me moment au cours de la semaine pr<e9>c<e9>dente, ils <e9>taient 60. En d<e9>pit des d<e9>clarations tardives encore attendues, une baisse du nombre des d<e9>c<e8>s est donc attendue pour la semaine sous revue par rapport <e0> la semaine pr<e9>c<e9>dente.","Nella settimana in rassegna, in tutta la Svizzera e in FL sono stati finora dichiarati 35<U+00A0>decessi in relazione alla COVID-19 confermata in laboratorio (0,4 per 100<U+00A0>000 abitanti). Fino allo stesso momento della settimana precedente ce ne sono stati 60. Nonostante le dichiarazioni tardive ancora attese, <e8> quindi probabile una diminuzione dei decessi nella settimana in rassegna rispetto a quella precedente.","F<fc>r die Berichtswoche wurden bisher <fc>ber die gesamte Schweiz und Liechtenstein 35 (0,4 pro 100<U+00A0>000 Einw.) Todesf<e4>lle im Zusammenhang mit einer laborbest<e4>tigten COVID-19-Erkrankung gemeldet. Zum selben Zeitpunkt in der Vorwoche waren dies 60 Todesf<e4>lle. Somit ist trotz der ausstehenden Nachmeldungen eine Abnahme der Todesf<e4>lle in der Berichtswoche im Vergleich zur Vorwoche zu erwarten.","F<fc>r die Berichtswoche wurden bisher <fc>ber die gesamte Schweiz und Liechtenstein 35 (0,4 pro 100<U+00A0>000 Einw.) Todesf<e4>lle im Zusammenhang mit einer laborbest<e4>tigten COVID-19-Erkrankung gemeldet. Zum selben Zeitpunkt in der Vorwoche waren dies 60 Todesf<e4>lle. Somit ist trotz der ausstehenden Nachmeldungen eine Abnahme der Todesf<e4>lle in der Berichtswoche im Vergleich zur Vorwoche zu erwarten.",202118,"2021-05-12_07-47-53","COVID19WeeklyReportText"
"deaths-geography","In 9 Kantonen und im FL wurden in der Berichtswoche keine Todesf<e4>lle verzeichnet. Die Rate der Todesf<e4>lle lag in allen Kantonen und im FL zwischen 0 und 2,7 Todesf<e4>llen pro 100<U+00A0>000 Einw.","Dans 9<U+00A0>cantons et au Liechtenstein, aucun d<e9>c<e8>s n<U+0092>a <e9>t<e9> recens<e9> pour la semaine sous revue. Le taux d<U+0092>incidence des d<e9>c<e8>s (taux de mortalit<e9>) dans tous les cantons et au Liechtenstein variait entre z<e9>ro et 2,7<U+00A0>d<e9>c<e8>s pour 100<U+00A0>000<U+00A0>habitants par canton.","In 9 Cantoni e in FL non sono stati registrati decessi nella settimana in rassegna. Il tasso di decessi in tutti i Cantoni e in FL ha oscillato tra 0 e 2,7 decessi ogni 100<U+00A0>000 abitanti.","In 9 Kantonen und im FL wurden in der Berichtswoche keine Todesf<e4>lle verzeichnet. Die Rate der Todesf<e4>lle lag in allen Kantonen und im FL zwischen 0 und 2,7 Todesf<e4>llen pro 100<U+00A0>000 Einw.","In 9 Kantonen und im FL wurden in der Berichtswoche keine Todesf<e4>lle verzeichnet. Die Rate der Todesf<e4>lle lag in allen Kantonen und im FL zwischen 0 und 2,7 Todesf<e4>llen pro 100<U+00A0>000 Einw.",202118,"2021-05-12_07-47-53","COVID19WeeklyReportText"
